id,name,balance,description,income,marriage,spouse
a25c41f7-eb1e-492f-92ac-e27d7e28af82,Michael Davis,94530.88,"Michael Davis works as a Health and safety adviser.
They earn money through their employment in the Jenkins Ltd where they have been for 9 years.
They are skilled in Networked full-range paradigm.",7576.12,Married,Karen Foster
4e326c8b-e1a1-4620-a79e-8c82497ded2a,James Horton,54910.54,"James Horton works as a Chief Financial Officer.
They earn money through their employment in the Stafford, Garner and Barajas where they have been for 19 years.
They are skilled in Multi-tiered directional superstructure.",1866.21,Married,Jessica Sanders
e05b6956-ff7b-4059-86e8-d09670b3ef71,Catherine Blair,10724.34,"Catherine Blair works as a Engineer, materials.
They earn money through their employment in the Hensley-James where they have been for 1 years.
They are skilled in Business-focused clear-thinking archive.",8014.24,Married,Eric Blair
5f2ce6cf-68f6-4f37-a578-94c4cdd58bc5,John Carr,82362.37,"John Carr works as a Physicist, medical.
They earn money through their employment in the Murray, Sanchez and Pham where they have been for 6 years.
They are skilled in Visionary cohesive artificial intelligence.",3068.58,Single,
28d7b85c-5b37-4a5f-aa59-f82cb41d351c,Amber Shaffer,42064.9,"Amber Shaffer works as a Interpreter.
They earn money through their employment in the Barnett-Larson where they have been for 6 years.
They are skilled in Adaptive radical Local Area Network.",6827.02,Single,
8ed93d1d-27c1-499a-8b98-ea48e8461bbe,Patrick Moore,75936.74,"Patrick Moore works as a Education officer, environmental.
They earn money through their employment in the Barajas-Kennedy where they have been for 6 years.
They are skilled in Multi-layered mobile help-desk.",8736.33,Married,George Wilson
585c6c40-84e2-4c14-a6a4-697b3a141051,Vincent Gutierrez,19875.85,"Vincent Gutierrez works as a Advertising copywriter.
They earn money through their employment in the Henson-Pennington where they have been for 4 years.
They are skilled in Distributed static monitoring.",9387.44,Married,Curtis Reed
8382e7dc-90e5-4054-9d99-7b48424aa2ad,Amanda Williams,36079.99,"Amanda Williams works as a Bookseller.
They earn money through their employment in the Mclaughlin, Holder and Parker where they have been for 7 years.
They are skilled in Stand-alone regional website.",7100.08,Single,
a3940e97-a803-4f50-846f-3847f5c18bce,Brent Keith,96583.32,"Brent Keith works as a Hydrogeologist.
They earn money through their employment in the Anderson-Lowe where they have been for 11 years.
They are skilled in Realigned solution-oriented productivity.",8714.4,Single,
e13e2948-8b72-4e8c-b398-d26750ee376f,Rodney Perez,76710.03,"Rodney Perez works as a Nurse, learning disability.
They earn money through their employment in the Jones-Brandt where they have been for 4 years.
They are skilled in Streamlined intermediate Graphic Interface.",5225.97,Single,
1eec812d-12eb-4df5-b05e-9a8f7c74adf0,Alexander Allison,74891.8,"Alexander Allison works as a Engineer, technical sales.
They earn money through their employment in the Perez, Sharp and Warren where they have been for 16 years.
They are skilled in Exclusive analyzing capacity.",8202.02,Single,
22a1702a-8a16-48b9-988e-2dcf532e5fc6,Kimberly Jones,3656.52,"Kimberly Jones works as a Engineer, chemical.
They earn money through their employment in the Tran, Bowman and Campbell where they have been for 11 years.
They are skilled in Fully-configurable system-worthy capability.",1224.33,Single,
0b1b5ef4-c1bf-4ca4-bdc0-08d648c3d7cb,Kristin Perez,66023.51,"Kristin Perez works as a Insurance claims handler.
They earn money through their employment in the Stephenson-Collins where they have been for 10 years.
They are skilled in Public-key maximized migration.",8009.54,Single,
1819aa1f-1615-4be7-802f-6e665b351966,Amanda Acosta,12306.75,"Amanda Acosta works as a Chief Executive Officer.
They earn money through their employment in the Price LLC where they have been for 16 years.
They are skilled in Inverse multi-state synergy.",1005.19,Married,Danny Smith
2309ecc6-dc72-4f66-8954-a12dc05f8caf,Joseph Ayala,34823.22,"Joseph Ayala works as a Diplomatic Services operational officer.
They earn money through their employment in the Brown Group where they have been for 14 years.
They are skilled in User-friendly eco-centric project.",4458.56,Married,Toni Banks
e4a5c320-70da-4a73-a18a-567eb387452a,Kathleen Schmidt,47086.86,"Kathleen Schmidt works as a Health physicist.
They earn money through their employment in the Jones and Sons where they have been for 15 years.
They are skilled in Progressive explicit matrix.",7750.55,Single,
23e47ff7-06f5-4aed-9597-20216f45eaa6,Luke Rowland,41276.37,"Luke Rowland works as a Archaeologist.
They earn money through their employment in the Mann LLC where they have been for 20 years.
They are skilled in Cloned logistical customer loyalty.",5937.88,Single,
c23fa2dd-f880-40be-a9c7-d8f40d766a07,Robert Wood,70971.94,"Robert Wood works as a Broadcast presenter.
They earn money through their employment in the Russell, Campbell and Hubbard where they have been for 4 years.
They are skilled in Ergonomic optimal definition.",8227.64,Single,
eb3a0ed5-f8c5-4957-a441-73c47762eb81,Traci Wilcox,66738.7,"Traci Wilcox works as a Intelligence analyst.
They earn money through their employment in the Buck-Owen where they have been for 20 years.
They are skilled in Managed dynamic superstructure.",1532.51,Married,Samuel Martin
4f2a5a14-f52f-4194-aa40-8c45f0fe3579,Brian Clark,93772.23,"Brian Clark works as a International aid/development worker.
They earn money through their employment in the Ruiz Group where they have been for 3 years.
They are skilled in Synergistic user-facing policy.",7840.32,Single,
eb5a3a5e-fa4e-4ed4-8528-1bdaffbc35da,Lindsey Morgan,37765.98,"Lindsey Morgan works as a Teacher, English as a foreign language.
They earn money through their employment in the Lane-Anderson where they have been for 14 years.
They are skilled in Reduced 5thgeneration migration.",7451.62,Married,John Garza
ca0a72e9-84b9-43ca-bd30-3cbb7354f87f,Xavier Watson,73921.25,"Xavier Watson works as a Health visitor.
They earn money through their employment in the Lewis-Cook where they have been for 8 years.
They are skilled in Future-proofed attitude-oriented info-mediaries.",2937.02,Married,Amy Alexander
68023a10-7140-4910-b19d-b2c9bf8b7f42,Denise Hodges,77323.18,"Denise Hodges works as a Copywriter, advertising.
They earn money through their employment in the Holmes, Morris and Hamilton where they have been for 7 years.
They are skilled in Organized fresh-thinking data-warehouse.",4072.37,Single,
faa0cdb7-58c6-4f16-8305-1c27bc323749,Stacy Buchanan,24359.79,"Stacy Buchanan works as a Comptroller.
They earn money through their employment in the Cameron, Roach and Richards where they have been for 3 years.
They are skilled in Reverse-engineered bifurcated Graphical User Interface.",2319.93,Married,Vicki Mack
b229a415-b059-4af5-851e-c886172f9633,Caitlin Russell,80817.07,"Caitlin Russell works as a Television camera operator.
They earn money through their employment in the Horton, Olsen and Hubbard where they have been for 16 years.
They are skilled in Up-sized actuating middleware.",7625.03,Married,Lori Sparks
2e9b5550-7723-4b17-b893-eef615ff5269,Shelby Townsend,41445.05,"Shelby Townsend works as a Clinical molecular geneticist.
They earn money through their employment in the Davis-Reynolds where they have been for 5 years.
They are skilled in Quality-focused dedicated portal.",8187.89,Single,
23989102-63d0-413b-ad2a-e850b0f06bf9,Rachel Jenkins,91697.46,"Rachel Jenkins works as a Chief Financial Officer.
They earn money through their employment in the Sandoval-Vargas where they have been for 13 years.
They are skilled in Proactive intangible system engine.",8143.07,Single,
246230c1-cc6e-4666-beea-b46dd4d546d4,Margaret May,51478.67,"Margaret May works as a Chartered management accountant.
They earn money through their employment in the Jackson-Franklin where they have been for 19 years.
They are skilled in Automated analyzing system engine.",5070.6,Married,Nathan Beck
43e73209-6e9b-4793-9948-bdfb9870cdcb,Diana Horton,87882.43,"Diana Horton works as a Plant breeder/geneticist.
They earn money through their employment in the Baker, Berg and Griffin where they have been for 4 years.
They are skilled in Phased explicit access.",9519.29,Married,James Harris
61db054f-2a15-4ab8-8b25-96bee278692b,Sean Brown,65535.75,"Sean Brown works as a Research scientist (physical sciences).
They earn money through their employment in the Wise, Villanueva and Perez where they have been for 19 years.
They are skilled in Pre-emptive zero tolerance Graphical User Interface.",2921.42,Married,Carol Burgess
8f08a077-42a3-4a3a-b324-fe02012b3942,Oscar Harper,39767.16,"Oscar Harper works as a Chief Technology Officer.
They earn money through their employment in the Rice-Pena where they have been for 10 years.
They are skilled in Versatile cohesive solution.",2756.42,Single,
f4250dcd-6dc2-4689-85e2-1ab7dc8fb8d9,Casey Edwards,7599.88,"Casey Edwards works as a Air cabin crew.
They earn money through their employment in the Luna LLC where they have been for 15 years.
They are skilled in Persevering hybrid paradigm.",1409.59,Married,Lisa Roberts
7aad3794-6f7d-429c-a131-09db4cddd351,Angelica Bowen,44228.58,"Angelica Bowen works as a Physiological scientist.
They earn money through their employment in the Sanchez, Sanchez and Ochoa where they have been for 1 years.
They are skilled in Optional methodical core.",8027.32,Single,
a65fde35-e6db-4309-88a1-76995af9307d,Derrick Wright,14036.66,"Derrick Wright works as a Pharmacist, community.
They earn money through their employment in the James, Mann and Cook where they have been for 17 years.
They are skilled in Mandatory stable time-frame.",8465.38,Single,
ea4d3553-176d-418b-8173-fc8e257a1708,Rebecca Porter,87996.42,"Rebecca Porter works as a Aeronautical engineer.
They earn money through their employment in the Gross, Coleman and Smith where they have been for 9 years.
They are skilled in Adaptive intangible Graphical User Interface.",2501.72,Single,
71664318-1d59-40c0-9254-a92021f61dc8,Michael Kim,59778.69,"Michael Kim works as a Sport and exercise psychologist.
They earn money through their employment in the Smith PLC where they have been for 13 years.
They are skilled in Polarized responsive instruction set.",1915.69,Married,Mitchell Washington
48e52cdc-d242-4589-ba62-55d9f56259b3,Jack Hunt,91415.88,"Jack Hunt works as a Scientist, research (life sciences).
They earn money through their employment in the Rios Ltd where they have been for 11 years.
They are skilled in Ergonomic non-volatile concept.",6535.69,Single,
36b5fbba-fa5e-4669-905b-97b4821febbe,Benjamin Diaz,78825.66,"Benjamin Diaz works as a Radio broadcast assistant.
They earn money through their employment in the Lee-Cook where they have been for 6 years.
They are skilled in Synchronized radical task-force.",3120.58,Single,
7fb4c581-2d93-4573-8072-d1960b3e3c9d,Deborah Craig,14280.6,"Deborah Craig works as a Medical technical officer.
They earn money through their employment in the Finley-Newton where they have been for 12 years.
They are skilled in Persistent directional application.",8469.98,Single,
0783ad75-1367-452d-a78a-5613563f6fa5,Dr. Joan Washington DDS,57114.22,"Dr. Joan Washington DDS works as a Designer, textile.
They earn money through their employment in the Bridges-Wolf where they have been for 9 years.
They are skilled in Business-focused eco-centric array.",2815.05,Single,
57b90196-addb-4c44-9a43-89a0b12436ba,Dr. Nathan Jensen PhD,65258.43,"Dr. Nathan Jensen PhD works as a Control and instrumentation engineer.
They earn money through their employment in the Miles Group where they have been for 13 years.
They are skilled in Face-to-face responsive projection.",5686.02,Married,Mr. Jose Ingram
709e896f-da21-4dc6-93b9-84878ad483d7,Hannah Christian,60866.29,"Hannah Christian works as a Trade mark attorney.
They earn money through their employment in the Adams Ltd where they have been for 4 years.
They are skilled in Enterprise-wide responsive neural-net.",9307.01,Married,Darlene Gibson
5dd2ebec-20d5-4d83-8d79-ea80ad062313,Thomas Miller,75399.89,"Thomas Miller works as a Psychologist, occupational.
They earn money through their employment in the Durham Ltd where they have been for 15 years.
They are skilled in Open-architected full-range archive.",6601.55,Single,
f2b33110-861d-4b5b-a7d4-c46883fc2fd5,April Mccoy,21746.86,"April Mccoy works as a Insurance account manager.
They earn money through their employment in the Gutierrez-Bennett where they have been for 12 years.
They are skilled in Multi-tiered executive success.",7018.11,Single,
17022fb2-6c1d-46bc-b906-1f48540a34f5,Harold Miller,37926.85,"Harold Miller works as a English as a foreign language teacher.
They earn money through their employment in the Johnson PLC where they have been for 1 years.
They are skilled in Progressive high-level encryption.",7838.69,Single,
525f40e8-8a3c-491d-8bb0-4bd43b3a64b5,John Martinez,47862.24,"John Martinez works as a Chief Technology Officer.
They earn money through their employment in the Freeman-Smith where they have been for 7 years.
They are skilled in Centralized asynchronous array.",9778.86,Single,
eb1f4262-51c0-4146-ab98-78a54e8aa1f4,Randall Jimenez,16181.11,"Randall Jimenez works as a Associate Professor.
They earn money through their employment in the Wiggins, Mendoza and Williams where they have been for 18 years.
They are skilled in Robust methodical Local Area Network.",1735.13,Single,
ced94748-62b8-48f4-989c-93b2c7f622c6,Michelle Campos,76777.15,"Michelle Campos works as a Transport planner.
They earn money through their employment in the Norton, Stephenson and Ford where they have been for 17 years.
They are skilled in Proactive user-facing functionalities.",8641.34,Married,Kristina Sanchez
eeca3a1a-f93c-4ffe-975f-95d52f8cfdd4,Joshua Lewis,88137.73,"Joshua Lewis works as a Waste management officer.
They earn money through their employment in the Frank-Sparks where they have been for 10 years.
They are skilled in Optional didactic access.",6804.12,Married,Brittany Adams
1b499511-b03d-4bf8-bbb1-bf67f94d00c6,Thomas Schultz,32351.67,"Thomas Schultz works as a Horticultural therapist.
They earn money through their employment in the Duran Ltd where they have been for 13 years.
They are skilled in Diverse intermediate productivity.",7713.09,Single,
7cc30f1d-621d-4dc1-8c23-2013621a8e06,Dennis Thompson Jr.,25203.04,"Dennis Thompson Jr. works as a Embryologist, clinical.
They earn money through their employment in the Elliott-Ray where they have been for 17 years.
They are skilled in Streamlined logistical intranet.",7741.84,Single,
2b7ab506-591c-4dc4-9421-e954cc60fa97,Shannon Robertson,49670.56,"Shannon Robertson works as a Proofreader.
They earn money through their employment in the Ramirez Group where they have been for 15 years.
They are skilled in Organic multimedia frame.",3663.19,Single,
f34a4db0-9f72-428e-b8b1-97c6f7a9c620,Christopher Roberts,65015.37,"Christopher Roberts works as a Merchandiser, retail.
They earn money through their employment in the George-Lewis where they have been for 5 years.
They are skilled in Digitized national application.",3543.12,Single,
d40886bc-fdfb-48c9-862b-1f7bf2808f74,Austin Browning,48634.02,"Austin Browning works as a Human resources officer.
They earn money through their employment in the Sanchez, Gonzalez and Porter where they have been for 14 years.
They are skilled in Networked logistical service-desk.",7527.25,Single,
88ef0180-b0f0-4843-ad06-3ea8e92db330,Leonard Hickman,9048.93,"Leonard Hickman works as a Television floor manager.
They earn money through their employment in the Rodriguez Group where they have been for 19 years.
They are skilled in Re-engineered impactful task-force.",4482.12,Single,
73b9b3f7-8178-44b2-93b2-ce0810153005,Jennifer Thompson,26752.52,"Jennifer Thompson works as a Conservation officer, nature.
They earn money through their employment in the Reynolds-Clark where they have been for 9 years.
They are skilled in Persevering responsive matrices.",6849.57,Single,
a135afa0-2b03-4437-9638-4d6a196ea351,Christopher Cardenas,70799.44,"Christopher Cardenas works as a Musician.
They earn money through their employment in the Robinson, Warner and Martinez where they have been for 1 years.
They are skilled in Expanded maximized open system.",5345.43,Married,Matthew Scott
418aff98-fd47-4336-9ef4-cc723b542a83,Rachel Fox,35027.37,"Rachel Fox works as a Quality manager.
They earn money through their employment in the Holmes and Sons where they have been for 17 years.
They are skilled in Enhanced exuding support.",2000.93,Single,
38b81e79-066b-4624-80b7-90bb4ab46ebe,Lisa Black,72354.86,"Lisa Black works as a Charity fundraiser.
They earn money through their employment in the Mckinney LLC where they have been for 17 years.
They are skilled in Enterprise-wide 4thgeneration productivity.",7321.54,Single,
8d7c5452-7d55-476f-af49-ab144fe4cec9,Jennifer Gibson,99514.18,"Jennifer Gibson works as a Estate manager/land agent.
They earn money through their employment in the Knox PLC where they have been for 3 years.
They are skilled in Streamlined 3rdgeneration monitoring.",9842.82,Married,Daniel Mcclain
9b8e7e92-06e8-4246-a19c-610cc8d0636d,Michele Lyons,84499.38,"Michele Lyons works as a Production manager.
They earn money through their employment in the Smith-Johnson where they have been for 13 years.
They are skilled in User-friendly motivating conglomeration.",3167.69,Married,Catherine Taylor
cc6ff8ed-c664-444a-bd92-253ddaee75e2,Angel Cole,69205.42,"Angel Cole works as a Museum/gallery curator.
They earn money through their employment in the Roberts-Kelley where they have been for 4 years.
They are skilled in Optional 4thgeneration solution.",9725.19,Married,Barbara Brown
08355513-5c7c-43f1-890e-09f0db3fb378,Tammy Hoffman,89160.32,"Tammy Hoffman works as a Quality manager.
They earn money through their employment in the Jacobs, Doyle and Johnson where they have been for 10 years.
They are skilled in Robust solution-oriented instruction set.",9857.81,Single,
4fcea4c7-e8e2-4bd9-b65f-ce20ada72b8b,Kimberly Madden,32685.14,"Kimberly Madden works as a Aeronautical engineer.
They earn money through their employment in the Davis Inc where they have been for 5 years.
They are skilled in Vision-oriented cohesive hub.",1994.42,Married,Felicia Schwartz
5bcbea3c-50ed-49ce-8633-2180a4e6a7ab,Emily Ellis,52156.5,"Emily Ellis works as a Furniture conservator/restorer.
They earn money through their employment in the George-Mueller where they have been for 1 years.
They are skilled in Seamless logistical superstructure.",3715.3,Married,Jonathan Thomas
9c525b5d-6168-4a13-9bb1-4557ea07bb24,Tonya Brown,67466.94,"Tonya Brown works as a Psychiatrist.
They earn money through their employment in the Shelton-Navarro where they have been for 6 years.
They are skilled in Triple-buffered content-based portal.",4824.83,Single,
6fb57fd8-1086-43b6-b0ea-7c4dbcb09b4c,Robin Greene,25517.5,"Robin Greene works as a Probation officer.
They earn money through their employment in the Williams Inc where they have been for 7 years.
They are skilled in Team-oriented disintermediate middleware.",7507.82,Single,
1e118660-8805-444c-9aae-c9d132d9e908,Abigail Mcmillan,31832.76,"Abigail Mcmillan works as a Bonds trader.
They earn money through their employment in the Cabrera-Jackson where they have been for 18 years.
They are skilled in Realigned fault-tolerant adapter.",8653.63,Married,Bailey Burke
cbca7d91-fc61-4722-be53-4eaf8777ba49,David Vaughn,72528.12,"David Vaughn works as a Public affairs consultant.
They earn money through their employment in the Moody-Peters where they have been for 18 years.
They are skilled in Networked upward-trending array.",5191.56,Married,Nicholas Browning
25471088-0763-4b29-bd1b-a724a6fa4132,Andre Knox,38648.98,"Andre Knox works as a Web designer.
They earn money through their employment in the Jackson-Anderson where they have been for 4 years.
They are skilled in Customizable reciprocal data-warehouse.",5721.68,Married,Katherine Novak
72d645d0-b25c-4295-9ff8-4357c83fb8b3,Cynthia Garcia,78143.59,"Cynthia Garcia works as a Rural practice surveyor.
They earn money through their employment in the Simmons LLC where they have been for 10 years.
They are skilled in Customer-focused next generation monitoring.",6179.82,Single,
070966d5-253a-4012-8c1a-5041278b1f95,Kyle Christensen,2389.56,"Kyle Christensen works as a Applications developer.
They earn money through their employment in the Williams-Smith where they have been for 13 years.
They are skilled in Customizable multi-state algorithm.",5197.35,Married,Lynn Sherman
b6dcd820-5680-4419-8ce7-fcd5aec36cd9,Jeffery Brown,93731.33,"Jeffery Brown works as a Secretary/administrator.
They earn money through their employment in the Davis Inc where they have been for 7 years.
They are skilled in De-engineered explicit workforce.",9625.34,Single,
1a2e2261-2b0a-4f8b-9148-f912356ae18d,Maria Ramirez,60407.03,"Maria Ramirez works as a Cabin crew.
They earn money through their employment in the Drake, Robbins and Wood where they have been for 9 years.
They are skilled in Multi-channeled reciprocal analyzer.",4053.45,Married,Karen Smith
b413ebc8-e5ee-413b-8b49-862deff9971d,William Nelson,80691.25,"William Nelson works as a Computer games developer.
They earn money through their employment in the Perez-Evans where they have been for 2 years.
They are skilled in Exclusive 6thgeneration methodology.",8148.72,Single,
a42ba536-fa6c-4292-9863-e7dcf5ad84be,Amanda Hughes,63802.87,"Amanda Hughes works as a Set designer.
They earn money through their employment in the Kemp-Floyd where they have been for 5 years.
They are skilled in Organized systematic strategy.",3951.04,Single,
9dd791c9-8ed8-4de1-9541-53178bb4b6f5,Carrie Rodriguez,1206.51,"Carrie Rodriguez works as a Arboriculturist.
They earn money through their employment in the Jenkins and Sons where they have been for 19 years.
They are skilled in Ergonomic multi-state info-mediaries.",8094.91,Married,Paul Holland
7c9c6a2a-1374-4f6f-b708-89c5a304c3fd,Erin Diaz,47560.65,"Erin Diaz works as a Estate manager/land agent.
They earn money through their employment in the Jones PLC where they have been for 18 years.
They are skilled in Expanded real-time migration.",3841.54,Married,Bobby Garcia
d67a00e1-ee1c-431d-bf3e-1eaca31f7791,Leslie West,63096.54,"Leslie West works as a Soil scientist.
They earn money through their employment in the Johnson Group where they have been for 4 years.
They are skilled in Enterprise-wide contextually-based customer loyalty.",5512.93,Single,
4781c787-1ea2-411e-87b2-f6c69e3119b3,Joshua Cummings,46103.01,"Joshua Cummings works as a Occupational hygienist.
They earn money through their employment in the Clark, Smith and Holland where they have been for 13 years.
They are skilled in Upgradable well-modulated firmware.",5338.06,Married,Rodney Kramer
9515e7a8-5beb-4cdf-8d85-f31cb8284e66,Travis Frost,66436.73,"Travis Frost works as a Medical sales representative.
They earn money through their employment in the Burke Inc where they have been for 1 years.
They are skilled in De-engineered optimizing infrastructure.",8410.38,Married,Anne Rice
aaef4bea-2171-4081-83a8-ea00a2420c97,Carolyn Cooper,2729.06,"Carolyn Cooper works as a Journalist, broadcasting.
They earn money through their employment in the Thomas-Burke where they have been for 5 years.
They are skilled in Adaptive coherent paradigm.",1586.41,Single,
56a76c96-017d-4216-8ce9-7a7d47b04dad,Andrea Lane,8100.29,"Andrea Lane works as a Regulatory affairs officer.
They earn money through their employment in the Mcgee, Hayes and Murray where they have been for 16 years.
They are skilled in Extended transitional Graphic Interface.",1584.38,Single,
3d98b844-a49c-4163-9bfa-3410164e3ef8,Kayla Osborn,65068.86,"Kayla Osborn works as a Arts development officer.
They earn money through their employment in the Aguilar, Bell and Sullivan where they have been for 5 years.
They are skilled in Advanced bifurcated Local Area Network.",8174.66,Married,Matthew Jenkins
4e3acdc2-5029-4f9c-a341-60b1ba27909f,Jennifer Lee,6417.33,"Jennifer Lee works as a Fisheries officer.
They earn money through their employment in the Hall, Cunningham and Horton where they have been for 8 years.
They are skilled in Optional even-keeled moratorium.",5844.83,Single,
2dbac1af-564c-4e9b-bab6-0630ae8a940f,James Fisher,21544.98,"James Fisher works as a Housing manager/officer.
They earn money through their employment in the Hunter-Arias where they have been for 16 years.
They are skilled in Up-sized fresh-thinking installation.",1237.97,Married,Michael Chapman
bd10f323-795a-43d9-91f0-776663ff5644,Chelsea Jackson,94283.97,"Chelsea Jackson works as a Art therapist.
They earn money through their employment in the Wood PLC where they have been for 13 years.
They are skilled in Re-engineered non-volatile application.",8996.22,Married,Brian Sanchez
842d825c-030c-4e2d-813a-99c6f083438d,Kevin Davis,23348.63,"Kevin Davis works as a Chief Strategy Officer.
They earn money through their employment in the Lyons, Andrews and Sandoval where they have been for 11 years.
They are skilled in Robust object-oriented open system.",9648.15,Single,
c33617a5-c0d7-468e-8352-46f7adb23874,John Gallagher,16952.5,"John Gallagher works as a Operations geologist.
They earn money through their employment in the Gonzalez Ltd where they have been for 3 years.
They are skilled in Intuitive zero tolerance time-frame.",9902.63,Married,Toni Chapman
