id,name,balance,description,income,marriage,spouse
24d1bc3c-047e-4495-8d4a-32b39dc8d786,Michelle Edwards,7166.95,"Michelle Edwards works as a Administrator, local government.
They earn money through their employment in the Valdez, Benson and Gill where they have been for 20 years.
They are skilled in Diverse impactful ability.",4274.69,Single,
4e08caed-486e-4f87-9dca-8cfac1e184d8,Karen Guerra,60985.98,"Karen Guerra works as a Chief Financial Officer.
They earn money through their employment in the Williams and Sons where they have been for 11 years.
They are skilled in Robust upward-trending infrastructure.",2504.8,Married,Brent Deleon
3d4aff8d-8c5c-4932-9039-868b65d934b5,Jason Chandler,12892.01,"Jason Chandler works as a Exhibition designer.
They earn money through their employment in the Grant PLC where they have been for 11 years.
They are skilled in Exclusive dynamic infrastructure.",2000.35,Single,
b5b22155-02c3-4126-a657-ebba341ee223,David Martinez,9995.47,"David Martinez works as a Diplomatic Services operational officer.
They earn money through their employment in the Thomas-Schmidt where they have been for 20 years.
They are skilled in De-engineered multi-state pricing structure.",6089.87,Single,
d9602694-41b6-4b9b-b9ce-410b8aa8d98e,Bobby Marsh,71231.52,"Bobby Marsh works as a Glass blower/designer.
They earn money through their employment in the Clay Group where they have been for 13 years.
They are skilled in Persistent executive parallelism.",5895.58,Single,
9ffd2fcb-6a14-43ad-b9c2-23fae07d46cc,Jessica Harris,9915.44,"Jessica Harris works as a Television production assistant.
They earn money through their employment in the Johnson-Banks where they have been for 3 years.
They are skilled in Re-contextualized didactic monitoring.",8086.36,Single,
8badfe8e-354d-4d6e-834a-0e3b7d4dd7aa,Sandra Blankenship,29025.09,"Sandra Blankenship works as a Architectural technologist.
They earn money through their employment in the Sullivan and Sons where they have been for 12 years.
They are skilled in User-friendly scalable policy.",3360.78,Married,David Bray
d8dd7fe9-dc35-497b-9a9a-aff3d087b068,Thomas Huerta,19839.02,"Thomas Huerta works as a Television camera operator.
They earn money through their employment in the Berg-Graves where they have been for 10 years.
They are skilled in Compatible methodical database.",8305.39,Single,
b41da458-0d6a-4f78-830c-87c52f2504de,Natasha Patterson,68740.77,"Natasha Patterson works as a Furniture conservator/restorer.
They earn money through their employment in the Tran and Sons where they have been for 6 years.
They are skilled in Multi-layered value-added database.",5758.32,Married,Lucas Mooney
a31ec75b-faf8-4d54-99af-3d34d1b4af04,Heather Harris,61169.06,"Heather Harris works as a Software engineer.
They earn money through their employment in the Rogers-Collins where they have been for 8 years.
They are skilled in Managed intangible emulation.",9322.7,Single,
e71a9c18-85e3-4416-9477-35eb9ae41465,Corey White,74432.28,"Corey White works as a Tour manager.
They earn money through their employment in the Cortez, Johnson and Hall where they have been for 10 years.
They are skilled in Integrated explicit leverage.",7033.93,Single,
5e1d3087-ce8c-4cf4-aeef-18346d4a64cc,Aaron Rose,91996.86,"Aaron Rose works as a Primary school teacher.
They earn money through their employment in the Young-Howe where they have been for 12 years.
They are skilled in Balanced fault-tolerant analyzer.",9144.76,Single,
b75aa9b8-d190-4972-b7d2-7c9591251103,Joan Hall,32997.77,"Joan Hall works as a Naval architect.
They earn money through their employment in the Smith, Lee and Serrano where they have been for 15 years.
They are skilled in Intuitive composite ability.",6219.39,Married,Sarah Schwartz
ccda8b9e-e589-4f03-b574-8fcfe628aba0,Anna Williams,57950.79,"Anna Williams works as a Logistics and distribution manager.
They earn money through their employment in the Velez Inc where they have been for 16 years.
They are skilled in Extended actuating migration.",4044.74,Single,
e33e688a-e596-4247-8416-ebe0e5178feb,Lisa Blanchard,84271.07,"Lisa Blanchard works as a Make.
They earn money through their employment in the Fischer Group where they have been for 15 years.
They are skilled in Multi-lateral analyzing architecture.",9653.21,Married,Evan Jennings
c4c843da-1e5e-423e-996f-ae5f65d5af1b,Kenneth May,35978.2,"Kenneth May works as a Therapist, art.
They earn money through their employment in the Rodriguez, Bush and Johnson where they have been for 7 years.
They are skilled in Multi-lateral impactful conglomeration.",7113.84,Married,Linda Pace
fb027e58-254d-4f7d-b0a0-322d760405f3,Todd Hall,64615.29,"Todd Hall works as a Software engineer.
They earn money through their employment in the Diaz, Alvarez and Scott where they have been for 20 years.
They are skilled in Persevering stable parallelism.",5409.9,Single,
0fa0285a-895a-4210-b6e5-3fb811222f50,Kimberly Crawford,28787.24,"Kimberly Crawford works as a Fitness centre manager.
They earn money through their employment in the Young-Bridges where they have been for 10 years.
They are skilled in Multi-layered disintermediate matrix.",3009.14,Single,
703b3dde-c64f-4715-8a0e-78e3374ef997,Brenda Mendez,82592.35,"Brenda Mendez works as a Accountant, chartered public finance.
They earn money through their employment in the Mack, Cruz and Stanley where they have been for 20 years.
They are skilled in Digitized bandwidth-monitored customer loyalty.",8376.67,Married,Nicole Conner
24e2c5f5-7988-41ff-a80c-45779445763f,Jason Stevens,94812.96,"Jason Stevens works as a Administrator, Civil Service.
They earn money through their employment in the Paul Group where they have been for 15 years.
They are skilled in Programmable regional support.",3607.28,Married,Christopher Sullivan
d4e3e950-821c-46f0-a837-d7944ad77f19,Rachel Wilson,27846.32,"Rachel Wilson works as a Accountant, chartered management.
They earn money through their employment in the Cole-Dennis where they have been for 1 years.
They are skilled in Intuitive analyzing initiative.",7414.13,Married,Kathleen Stone
616cdd1f-59fa-4aea-a51d-e5eb01f837d7,Sabrina Knapp,75464.85,"Sabrina Knapp works as a Therapist, horticultural.
They earn money through their employment in the Wilson, Hunt and Castro where they have been for 12 years.
They are skilled in Progressive demand-driven methodology.",8205.74,Married,Sherry Giles
05ea63c9-c5ea-4420-9aed-0f040299132c,Tina Solis,99549.92,"Tina Solis works as a Scientist, research (physical sciences).
They earn money through their employment in the Franklin-White where they have been for 15 years.
They are skilled in Automated hybrid encoding.",3652.31,Single,
03208bb8-a4e8-4acf-aef7-fbe34dd8744b,Susan Sanchez,73794.59,"Susan Sanchez works as a Health visitor.
They earn money through their employment in the Brooks, Garcia and Terrell where they have been for 17 years.
They are skilled in Synergistic disintermediate architecture.",4748.03,Single,
a49bd8d2-c4df-4eef-b83d-f231d271135b,Brian Oconnell,78713.72,"Brian Oconnell works as a Records manager.
They earn money through their employment in the Smith-Mitchell where they have been for 18 years.
They are skilled in Enterprise-wide user-facing database.",5305.96,Married,Dylan Roth
ffeb06f8-49cd-41c8-9f86-3ef1f482c3c2,Jennifer Martinez,23068.56,"Jennifer Martinez works as a Museum/gallery exhibitions officer.
They earn money through their employment in the George Group where they have been for 9 years.
They are skilled in Customizable multi-state definition.",9340.08,Single,
142f0f8a-40b5-4936-bba7-dc83ba42ea18,Dr. Deborah Meyer DVM,31964.45,"Dr. Deborah Meyer DVM works as a Farm manager.
They earn money through their employment in the Patterson Ltd where they have been for 20 years.
They are skilled in De-engineered heuristic hub.",1877.63,Married,Yvette Boyd DDS
6c03c181-814b-4801-8738-5c8b3572dbfd,Courtney Rodriguez,82618.76,"Courtney Rodriguez works as a Risk analyst.
They earn money through their employment in the Pacheco Ltd where they have been for 14 years.
They are skilled in Optimized dedicated function.",8528.75,Married,Amy Valdez
4790193a-5b55-439e-8cd2-c5cbc0e5bf90,James Alexander,26264.89,"James Alexander works as a Visual merchandiser.
They earn money through their employment in the Smith PLC where they have been for 1 years.
They are skilled in Automated background orchestration.",4740.07,Single,
d46597f5-281d-41cb-8c02-c04cd228e455,Robert Smith,94325.34,"Robert Smith works as a Theatre director.
They earn money through their employment in the Shields-Campos where they have been for 1 years.
They are skilled in Assimilated cohesive migration.",8719.81,Single,
cec7e221-e147-4acf-8cc9-0aab03e0ffcc,Heidi Dunn,81991.62,"Heidi Dunn works as a Hydrologist.
They earn money through their employment in the White Ltd where they have been for 8 years.
They are skilled in Secured fault-tolerant hierarchy.",7467.49,Married,Steven Reynolds
d5fb9df7-6f0b-45c1-9414-39fd349b81c8,Kimberly Ballard,28080.35,"Kimberly Ballard works as a Insurance underwriter.
They earn money through their employment in the Cox and Sons where they have been for 4 years.
They are skilled in Versatile systemic throughput.",9121.66,Single,
d5d2c93c-cc7d-4199-8060-6056a03238fa,Travis Patterson,60607.61,"Travis Patterson works as a Publishing copy.
They earn money through their employment in the Moore-Preston where they have been for 20 years.
They are skilled in Fully-configurable object-oriented conglomeration.",3749.02,Married,Evan Hughes
1a217442-7bef-4e59-a8dc-a450451cb4c8,Alexis Taylor,24261.52,"Alexis Taylor works as a Architectural technologist.
They earn money through their employment in the Cannon LLC where they have been for 4 years.
They are skilled in Versatile interactive customer loyalty.",4710.0,Single,
07841426-9ed9-40b7-882f-bfd46709885d,Oscar Stevens,82639.9,"Oscar Stevens works as a Paramedic.
They earn money through their employment in the Gray and Sons where they have been for 20 years.
They are skilled in Synchronized high-level algorithm.",4941.2,Single,
64c750c0-2cc9-4a2a-b8f1-16f4c79a8ac5,David Davis,18635.88,"David Davis works as a Video editor.
They earn money through their employment in the Smith Group where they have been for 6 years.
They are skilled in Visionary discrete info-mediaries.",7152.35,Single,
45de0b67-8d15-4317-9109-a2edc4078fa3,Edward Roy,45205.65,"Edward Roy works as a Police officer.
They earn money through their employment in the Macias-Scott where they have been for 4 years.
They are skilled in Configurable full-range database.",8793.21,Married,Austin White
7fd88b0a-09ed-45ff-813a-5a1da56ef2e8,Nicolas Johnson,9531.27,"Nicolas Johnson works as a Surveyor, rural practice.
They earn money through their employment in the Walker, Richardson and Hansen where they have been for 12 years.
They are skilled in Innovative bottom-line ability.",7964.45,Married,Mr. Matthew Moran
402ab5ec-f9dc-41e4-a3e2-4f251af4c3e1,Nicole Doyle,61292.81,"Nicole Doyle works as a Surveyor, insurance.
They earn money through their employment in the Howard, Ritter and Chavez where they have been for 18 years.
They are skilled in Versatile holistic solution.",4420.91,Married,Mary Riggs
6ff33be4-1d10-4740-850b-a173baf3ab04,Jennifer Gibson,85386.9,"Jennifer Gibson works as a Trading standards officer.
They earn money through their employment in the Alvarado PLC where they have been for 4 years.
They are skilled in Versatile tangible monitoring.",9325.23,Married,Mark Blackburn
4ea2bd52-f808-4d05-ac19-94bfa9c22981,Kevin Pierce,30397.21,"Kevin Pierce works as a Immigration officer.
They earn money through their employment in the Ramsey-Mcgrath where they have been for 6 years.
They are skilled in Integrated responsive support.",9687.53,Single,
bb73c90c-d9dd-4ae6-a0e8-ce16afbe85cc,Jamie Lee,68789.72,"Jamie Lee works as a Designer, interior/spatial.
They earn money through their employment in the Ray, Arias and Sanchez where they have been for 19 years.
They are skilled in Programmable empowering portal.",4696.69,Single,
b568322a-89b2-4c09-8369-63597e41c156,Susan Morgan,48649.78,"Susan Morgan works as a Theatre director.
They earn money through their employment in the Copeland, Fry and Diaz where they have been for 8 years.
They are skilled in Implemented impactful matrix.",4682.01,Married,James Sullivan
63541a9e-b197-48bb-b0d3-9ff9ce3225d1,Leonard Garcia,11170.81,"Leonard Garcia works as a Financial trader.
They earn money through their employment in the Cervantes Ltd where they have been for 16 years.
They are skilled in Down-sized 3rdgeneration infrastructure.",7143.61,Married,Stephanie Wilson
0262882d-0f32-4305-a18b-6e956dbd834b,Jeffrey Jones,74361.55,"Jeffrey Jones works as a Fashion designer.
They earn money through their employment in the Rivera LLC where they have been for 13 years.
They are skilled in Up-sized static core.",7612.63,Single,
551c3f65-59ca-4c48-954a-7ac6c0ff4177,Gene Meyer,20282.75,"Gene Meyer works as a Teacher, early years/pre.
They earn money through their employment in the Mcguire, Rodriguez and Garcia where they have been for 6 years.
They are skilled in Quality-focused reciprocal standardization.",2054.09,Single,
2502b41d-a868-4ab6-b271-ba29149b1941,Linda Thomas,94256.58,"Linda Thomas works as a Broadcast presenter.
They earn money through their employment in the Madden, Johnson and Hogan where they have been for 15 years.
They are skilled in Polarized multi-tasking solution.",3962.75,Married,Ashley Herrera
0610c16f-7842-40c7-a029-40e2fd9b4911,Melinda Joseph,73491.61,"Melinda Joseph works as a Advice worker.
They earn money through their employment in the Tran, Ross and Gibson where they have been for 12 years.
They are skilled in Up-sized heuristic functionalities.",8967.9,Married,Reginald Jones
50e58e7e-a699-405b-9483-dfa40f54bf3c,Joshua Wright,37194.61,"Joshua Wright works as a Location manager.
They earn money through their employment in the Shelton PLC where they have been for 2 years.
They are skilled in Fundamental exuding access.",5305.77,Single,
ed498b5c-576f-4e43-80d0-97a183b7be5d,Scott Nguyen,11745.19,"Scott Nguyen works as a Clothing/textile technologist.
They earn money through their employment in the Taylor, Long and Newman where they have been for 17 years.
They are skilled in Open-source attitude-oriented Graphical User Interface.",7233.26,Married,Christina Anderson
ac008aa1-0de0-422a-9192-5dd6efe3a968,Ashley Hartman,80756.78,"Ashley Hartman works as a Fine artist.
They earn money through their employment in the Knox Inc where they have been for 15 years.
They are skilled in Public-key human-resource adapter.",9475.84,Married,Christina Yates
6fa998b5-f50e-46d2-9cb9-df0605ec8856,William Watkins,72873.28,"William Watkins works as a Podiatrist.
They earn money through their employment in the Gilmore, Cobb and Shelton where they have been for 8 years.
They are skilled in Open-source didactic process improvement.",5626.06,Married,Jennifer Sosa
3b6ba445-43a0-4cd8-bfae-ec4e236d3a53,Jessica Miller,80641.76,"Jessica Miller works as a Editorial assistant.
They earn money through their employment in the Turner, Villarreal and Harris where they have been for 6 years.
They are skilled in Automated 6thgeneration time-frame.",4005.32,Single,
c4d5656c-235b-4f4e-903a-45ffced748d3,Charles Lewis,19803.25,"Charles Lewis works as a Financial manager.
They earn money through their employment in the Baker-Martinez where they have been for 1 years.
They are skilled in Universal demand-driven Internet solution.",9065.58,Married,Robert Kirby
5137bd02-d7c6-472f-bf84-90f38a1ff340,Veronica Smith,9206.02,"Veronica Smith works as a Surveyor, planning and development.
They earn money through their employment in the Stein-Gray where they have been for 5 years.
They are skilled in Customizable mission-critical migration.",5002.09,Married,Laura Lang
a36c572f-749d-4768-880e-2f8109ce5c76,Jesse Harvey,43548.98,"Jesse Harvey works as a Research scientist (maths).
They earn money through their employment in the Lewis-Chavez where they have been for 2 years.
They are skilled in Networked transitional adapter.",8078.15,Married,Stephen Williams
9300d3a5-0729-4edd-b7c0-0c9d7d07860d,Amy Roy,38925.38,"Amy Roy works as a Production designer, theatre/television/film.
They earn money through their employment in the Pitts, Schmidt and Franklin where they have been for 8 years.
They are skilled in Adaptive tangible matrix.",5946.0,Single,
b53d625c-fbbc-4c9f-9484-5dc247a72d3d,Erica Meyer,94052.75,"Erica Meyer works as a Trading standards officer.
They earn money through their employment in the Chase-Mendez where they have been for 12 years.
They are skilled in Cloned content-based Internet solution.",7751.83,Married,Joshua Hernandez
a0067d9e-32f8-4b62-97e1-7da5601bdcb5,Eric Jennings,72202.71,"Eric Jennings works as a Research scientist (maths).
They earn money through their employment in the Rice, Anderson and Olson where they have been for 17 years.
They are skilled in Down-sized modular synergy.",9398.06,Married,Mrs. Danielle Garcia
e232a00e-9dcb-476f-92cc-954e01196277,Sarah Griffith,8718.87,"Sarah Griffith works as a Surveyor, hydrographic.
They earn money through their employment in the Chandler, Blackburn and Li where they have been for 1 years.
They are skilled in Devolved demand-driven forecast.",9490.36,Single,
e20d9565-a170-4479-aec0-eca2abad4a50,Kristin Moore,3300.7,"Kristin Moore works as a Designer, industrial/product.
They earn money through their employment in the Sanders-Trevino where they have been for 14 years.
They are skilled in Team-oriented explicit projection.",1159.53,Married,Rebecca Jones
6fa04860-c5f4-468d-9d9f-e63ce760f83e,Christine Bowers,89073.68,"Christine Bowers works as a Scientist, research (physical sciences).
They earn money through their employment in the Jones and Sons where they have been for 4 years.
They are skilled in Intuitive non-volatile solution.",6483.64,Single,
a0efdea6-ce2f-4f3c-9c49-d361ab0b10c2,Jerry Evans,69128.15,"Jerry Evans works as a Charity officer.
They earn money through their employment in the Harris, Coleman and Bradley where they have been for 12 years.
They are skilled in Organized dynamic portal.",9106.59,Single,
b640715b-4767-4104-88db-c3760620fb8e,James Vaughn,33164.73,"James Vaughn works as a Call centre manager.
They earn money through their employment in the Rhodes-Phillips where they have been for 7 years.
They are skilled in Enterprise-wide interactive definition.",7525.19,Single,
de106743-3e98-49f5-a2cb-876d5bf11436,Vanessa Carrillo,65855.48,"Vanessa Carrillo works as a Engineer, technical sales.
They earn money through their employment in the Hartman, Jackson and Wilson where they have been for 12 years.
They are skilled in De-engineered bandwidth-monitored adapter.",5447.75,Single,
215fbc18-b7c4-4e0c-a41b-695969d4180d,Blake Wagner,91509.1,"Blake Wagner works as a Actor.
They earn money through their employment in the Blankenship Inc where they have been for 12 years.
They are skilled in Profound coherent help-desk.",2749.07,Married,Paige Rodriguez
2f8c8018-b7b0-4ac6-a209-727136f5b71b,Linda Beasley,56041.61,"Linda Beasley works as a Insurance risk surveyor.
They earn money through their employment in the Warren-Nguyen where they have been for 1 years.
They are skilled in Managed bi-directional installation.",8148.42,Married,Michele Thompson
33e53c01-d78a-434b-a8c3-234ac261b96d,Patricia Garcia,32865.61,"Patricia Garcia works as a Human resources officer.
They earn money through their employment in the Fisher-Bautista where they have been for 18 years.
They are skilled in Monitored non-volatile Local Area Network.",4905.24,Single,
aed475ad-8377-457e-bc06-4dbac9d7bde0,Melissa Johnson,15225.99,"Melissa Johnson works as a Surveyor, minerals.
They earn money through their employment in the Ramirez-Mathis where they have been for 6 years.
They are skilled in Inverse mission-critical policy.",2162.96,Single,
e7589302-2d56-4ed5-b8de-54be55f7684c,Kevin Barnes,81747.86,"Kevin Barnes works as a Therapist, speech and language.
They earn money through their employment in the Bishop-Brown where they have been for 1 years.
They are skilled in Mandatory executive open system.",5774.9,Single,
939dbc03-b700-43d6-8c73-dfb1d78f9e7b,Timothy Williams,63655.48,"Timothy Williams works as a Insurance broker.
They earn money through their employment in the Carson-Johnson where they have been for 9 years.
They are skilled in Programmable user-facing initiative.",2405.67,Single,
8b5f9159-8b7d-4bd8-abe8-d1728e43736b,Brenda Turner,30826.16,"Brenda Turner works as a Lecturer, higher education.
They earn money through their employment in the Hodge Ltd where they have been for 6 years.
They are skilled in Configurable didactic neural-net.",1203.49,Married,Michelle Morris
ad47ae74-03e2-4370-a960-22b91845d310,Robert Bailey,26069.1,"Robert Bailey works as a Physiotherapist.
They earn money through their employment in the Washington-Aguilar where they have been for 18 years.
They are skilled in Total analyzing model.",9353.04,Married,Andrew Hill
55eba0f0-11b7-4fc5-84f1-7b63af417118,Anna Jones,90748.48,"Anna Jones works as a Trading standards officer.
They earn money through their employment in the Garcia, Mccall and Jones where they have been for 1 years.
They are skilled in Cloned scalable instruction set.",8802.37,Single,
8bafe47c-0303-44b8-9e23-48914a043195,Gerald Martinez,35164.96,"Gerald Martinez works as a Fast food restaurant manager.
They earn money through their employment in the Rice, Reese and Robinson where they have been for 4 years.
They are skilled in Proactive web-enabled productivity.",5048.5,Married,Mary Ayers
d06d2c2d-a8c4-4f77-bf25-1a88ad7b368f,Kimberly Caldwell,5671.6,"Kimberly Caldwell works as a Fish farm manager.
They earn money through their employment in the Barker-Smith where they have been for 17 years.
They are skilled in Expanded reciprocal adapter.",3153.57,Single,
5a6f1ab5-1b83-49ac-9e65-e7d5fe75adf9,Harry Gibson,58672.18,"Harry Gibson works as a Jewellery designer.
They earn money through their employment in the Vargas Inc where they have been for 3 years.
They are skilled in Distributed reciprocal attitude.",1585.15,Single,
207f8d1e-5d8d-4bf9-9a5f-68d1bfc71cbc,Jennifer Anderson,43488.82,"Jennifer Anderson works as a Occupational psychologist.
They earn money through their employment in the Padilla-Brown where they have been for 9 years.
They are skilled in Expanded reciprocal database.",2688.05,Married,Zachary Owens
7c0245a1-87e0-4f91-8461-90f2e8ac37f3,Heather Alvarez,43199.76,"Heather Alvarez works as a Seismic interpreter.
They earn money through their employment in the Holden, Williams and Burns where they have been for 13 years.
They are skilled in Stand-alone demand-driven budgetary management.",1410.14,Married,Adam Benton
5c289238-60cb-47f9-8cb4-769ffd931ad0,Brandon Cox,31424.27,"Brandon Cox works as a Trade mark attorney.
They earn money through their employment in the Brown and Sons where they have been for 18 years.
They are skilled in Monitored intermediate structure.",3357.5,Single,
83eddc34-dc27-4b8d-ae60-f39148b64014,Wyatt Scott,84025.13,"Wyatt Scott works as a Interior and spatial designer.
They earn money through their employment in the Marks and Sons where they have been for 9 years.
They are skilled in Customer-focused systematic synergy.",7207.09,Married,Charles Holland
0f0cf391-cc1e-4765-bcbf-48390a3ae768,Eric Valencia,54274.89,"Eric Valencia works as a Hydrologist.
They earn money through their employment in the Carroll, Williams and Castro where they have been for 14 years.
They are skilled in Universal client-driven adapter.",7464.1,Single,
1d3b72b7-92b8-41c9-a50d-5b0563e86388,Michael Nguyen,70285.84,"Michael Nguyen works as a Scientist, audiological.
They earn money through their employment in the Morgan Ltd where they have been for 10 years.
They are skilled in Implemented client-driven array.",4742.34,Single,
bf433617-afc6-41bb-97cb-8e774f6cdf3c,Sue Pruitt,50744.37,"Sue Pruitt works as a Information officer.
They earn money through their employment in the Adams-Davis where they have been for 16 years.
They are skilled in Balanced zero administration Graphical User Interface.",7542.18,Married,Daniel Davis
4a457df3-334f-4fa9-882f-846c12741fe3,Jimmy Reyes,24588.55,"Jimmy Reyes works as a Contractor.
They earn money through their employment in the Brooks, Mcfarland and Perez where they have been for 3 years.
They are skilled in Universal holistic throughput.",6374.48,Single,
320fdd2f-c518-4f55-8e92-6539cad9a9e3,Stephanie Johnson,13762.16,"Stephanie Johnson works as a Dramatherapist.
They earn money through their employment in the Marks LLC where they have been for 1 years.
They are skilled in Synergistic disintermediate service-desk.",2156.63,Married,Shari Rhodes
5891c426-b0de-4732-a245-491c27236d39,Ms. Nancy Mcdonald MD,29004.57,"Ms. Nancy Mcdonald MD works as a Engineer, land.
They earn money through their employment in the Walsh, Ellis and Clark where they have been for 20 years.
They are skilled in Visionary bottom-line support.",5589.02,Married,Austin Campbell
ada7d453-1d65-47e6-a1b7-bc0c16484397,Phillip Gallegos,47429.6,"Phillip Gallegos works as a Recycling officer.
They earn money through their employment in the Caldwell, Donaldson and Webb where they have been for 15 years.
They are skilled in Advanced 5thgeneration paradigm.",2949.24,Married,Joshua Thomas
e4c271f0-ef8a-4fd3-9eaa-b2fdbcb2e437,Brittany Mccarty,27294.96,"Brittany Mccarty works as a Proofreader.
They earn money through their employment in the Nelson Group where they have been for 3 years.
They are skilled in Multi-channeled directional framework.",6442.51,Married,Tyler Allen
