id,name,balance,description,income,marriage,spouse
0d7c7639-b4c7-4677-ab6c-ff22cf2d0e61,Katherine Cooke,56559.79,"Katherine Cooke works as a Minerals surveyor.
They earn money through their employment in the Huang, Williams and Duarte where they have been for 17 years.
They are skilled in Stand-alone analyzing implementation.",6849.24,Single,
8818c97c-d5e9-4045-862f-4c19e967dbad,Kerri Wilson,65856.92,"Kerri Wilson works as a Clothing/textile technologist.
They earn money through their employment in the Moore-Branch where they have been for 7 years.
They are skilled in Stand-alone 24/7 definition.",6366.38,Married,Martin Lin
a5150e19-ba9a-44d9-a254-1440e848e9cb,Charlotte Sanchez,34158.41,"Charlotte Sanchez works as a Commissioning editor.
They earn money through their employment in the Nichols, Olson and Wiggins where they have been for 10 years.
They are skilled in Innovative human-resource approach.",3786.89,Single,
aef173cf-6d86-4b3b-9664-227789372670,Christopher Brown,67677.86,"Christopher Brown works as a Producer, television/film/video.
They earn money through their employment in the Booth-Alvarez where they have been for 3 years.
They are skilled in Multi-tiered empowering product.",9584.56,Single,
f5b59bfa-cb9c-4bc2-85fe-72cbddcc78f5,Robert Stevenson,14750.39,"Robert Stevenson works as a Commercial/residential surveyor.
They earn money through their employment in the Adams-Nichols where they have been for 17 years.
They are skilled in Decentralized 24hour core.",7634.97,Single,
3ea34b87-774f-4e1a-b6ae-6393da85a06a,Frank Murphy,50601.58,"Frank Murphy works as a Market researcher.
They earn money through their employment in the Rodriguez PLC where they have been for 8 years.
They are skilled in Realigned coherent implementation.",3279.87,Married,Lori Wilson
81d2cc0a-d294-4520-a405-0d5a702603b2,Jennifer Collins,65926.72,"Jennifer Collins works as a Interior and spatial designer.
They earn money through their employment in the Morris-Walker where they have been for 10 years.
They are skilled in Reduced scalable core.",4840.75,Married,Aaron Mann
83f91915-f599-40ff-8549-1cf6cd716107,Louis Ayala,7172.78,"Louis Ayala works as a Administrator, arts.
They earn money through their employment in the Gutierrez, Wright and Newton where they have been for 7 years.
They are skilled in Stand-alone 5thgeneration service-desk.",3704.26,Married,Julie Smith
8c3ce5f2-fd3e-49ee-89e0-7b35643f207d,Nathan Copeland Jr.,31506.63,"Nathan Copeland Jr. works as a Radiographer, therapeutic.
They earn money through their employment in the Gordon, Brennan and Reyes where they have been for 18 years.
They are skilled in Realigned asymmetric knowledge user.",6881.44,Single,
6f563203-51a7-4233-bf11-61695054627d,Jose Paul,56662.35,"Jose Paul works as a Recruitment consultant.
They earn money through their employment in the Anderson-Blake where they have been for 12 years.
They are skilled in De-engineered explicit instruction set.",2126.91,Married,Kathryn Robbins
eceb1113-1959-44eb-9aac-e5add1794332,Barbara Meyer,24981.42,"Barbara Meyer works as a Theatre director.
They earn money through their employment in the Duffy, Williams and Wells where they have been for 12 years.
They are skilled in Pre-emptive explicit collaboration.",7932.21,Single,
f10c04df-61b3-44b4-a465-f7240d3150d4,Antonio Morris,94123.35,"Antonio Morris works as a Engineering geologist.
They earn money through their employment in the Martinez-Garcia where they have been for 8 years.
They are skilled in Horizontal needs-based throughput.",5415.55,Single,
951025a1-5318-4dc5-b221-18b2a868ad42,Jeffrey Colon,73798.23,"Jeffrey Colon works as a Chemical engineer.
They earn money through their employment in the Roberts-Diaz where they have been for 5 years.
They are skilled in Virtual multi-tasking throughput.",9096.71,Married,Shaun Thompson
7f4fef89-c9bb-454f-bca4-101e85927799,Deborah Stewart,12952.72,"Deborah Stewart works as a Tax inspector.
They earn money through their employment in the Owen-Moore where they have been for 5 years.
They are skilled in Fully-configurable even-keeled benchmark.",5632.65,Married,Michelle Rose
a2c443b9-ed9f-456b-9b4d-56eb571fac5c,Andrew Lee MD,7677.91,"Andrew Lee MD works as a Hydrographic surveyor.
They earn money through their employment in the Greer, Young and Zimmerman where they have been for 8 years.
They are skilled in Customizable tertiary standardization.",6715.05,Married,Matthew Riley
67f10482-27a0-4f1c-8f82-32ad9e2ddf7c,David Thomas,32662.21,"David Thomas works as a Accountant, chartered certified.
They earn money through their employment in the Glenn Inc where they have been for 12 years.
They are skilled in Open-source bandwidth-monitored contingency.",8052.47,Married,Dominique Smith
49625394-41b3-479d-b690-68f647d91505,Edward Nelson,98217.5,"Edward Nelson works as a Civil engineer, contracting.
They earn money through their employment in the Lucas Ltd where they have been for 6 years.
They are skilled in Persevering system-worthy customer loyalty.",3695.68,Married,Timothy Ramirez
de87272a-9d0c-4b6f-aeda-2018ad5583c5,Renee Cross,29195.12,"Renee Cross works as a Training and development officer.
They earn money through their employment in the Petersen, Perry and Reed where they have been for 5 years.
They are skilled in Function-based executive Internet solution.",8186.96,Single,
6620b824-bca2-4451-92f9-c4fe0b3ec58f,Allison Terry,44428.88,"Allison Terry works as a Statistician.
They earn money through their employment in the Day, Gardner and Anderson where they have been for 15 years.
They are skilled in Innovative national success.",1221.12,Single,
dbf27230-0216-4984-a057-09e5c9a1cba6,Amanda Hernandez,21123.32,"Amanda Hernandez works as a Secondary school teacher.
They earn money through their employment in the Washington, York and Garrison where they have been for 13 years.
They are skilled in Self-enabling hybrid pricing structure.",1604.98,Married,Anthony Cabrera
8b57d922-1715-41b9-a547-b96ea00522de,Sean Rangel,77282.85,"Sean Rangel works as a Trade union research officer.
They earn money through their employment in the Shaffer PLC where they have been for 16 years.
They are skilled in Implemented tangible Graphical User Interface.",7396.12,Married,Martin Garcia
dcf8e45f-aa31-4054-a4a4-db94d1256841,Brian Foster,77218.15,"Brian Foster works as a Counselling psychologist.
They earn money through their employment in the Gray LLC where they have been for 3 years.
They are skilled in Team-oriented contextually-based product.",1316.37,Single,
ce4b7adb-10fb-481a-abf2-6250d11194f0,Curtis Spencer,92400.81,"Curtis Spencer works as a Engineer, petroleum.
They earn money through their employment in the Faulkner, Dyer and Howard where they have been for 8 years.
They are skilled in Enterprise-wide cohesive challenge.",6489.27,Married,Amy Barnett
937981ba-6277-475a-b5c7-235e91fb95b3,Natalie Lee,33957.01,"Natalie Lee works as a Field trials officer.
They earn money through their employment in the Villegas, Rogers and Murray where they have been for 12 years.
They are skilled in Monitored holistic intranet.",3710.07,Married,John Brady
85801eac-f1c0-475b-a97c-07dad6cfe40c,Yolanda Chambers,89382.28,"Yolanda Chambers works as a Special effects artist.
They earn money through their employment in the Reynolds Group where they have been for 6 years.
They are skilled in Stand-alone zero administration alliance.",2451.05,Married,Eric Martinez
0af7ef74-723c-471c-81fe-0c3bb3a24bdd,Alexandra Orozco,32602.34,"Alexandra Orozco works as a Financial controller.
They earn money through their employment in the Nelson Ltd where they have been for 14 years.
They are skilled in Profit-focused zero tolerance matrices.",9954.54,Single,
36114dda-de07-4749-89da-dca36bae397a,Margaret Oneill,62533.55,"Margaret Oneill works as a Higher education careers adviser.
They earn money through their employment in the Nash-Ellis where they have been for 6 years.
They are skilled in Enhanced optimizing solution.",8272.32,Single,
171b23fa-36e2-400d-89dd-d2dcd8c13726,Michael Proctor,31707.29,"Michael Proctor works as a Advertising account executive.
They earn money through their employment in the King-Johnston where they have been for 20 years.
They are skilled in Horizontal bandwidth-monitored support.",9479.27,Married,Destiny Mayer
687c3f0f-d0e5-4a07-8530-50e40cd064ec,Bryce Shaw,48815.9,"Bryce Shaw works as a Fashion designer.
They earn money through their employment in the Stone PLC where they have been for 12 years.
They are skilled in Enhanced local pricing structure.",7311.45,Married,Sherry Gardner
16708565-a65a-4f00-9ebf-28a9184a5df6,Joseph Massey,76614.66,"Joseph Massey works as a Corporate investment banker.
They earn money through their employment in the Sullivan, Lawrence and Knight where they have been for 4 years.
They are skilled in Ergonomic value-added focus group.",2694.18,Married,Miguel Brooks
5305eedc-9f1a-4093-9c1a-ae5cdc90082e,Aaron Castro,44165.07,"Aaron Castro works as a Psychologist, prison and probation services.
They earn money through their employment in the Scott-Clarke where they have been for 13 years.
They are skilled in Profound fresh-thinking projection.",5784.64,Married,Steven Johnson
f3b70be9-309b-451b-84e1-1730e0a976e7,John Lopez,51238.21,"John Lopez works as a Civil engineer, consulting.
They earn money through their employment in the Morris Group where they have been for 9 years.
They are skilled in Inverse value-added system engine.",8510.61,Married,James Erickson
e2f5e05b-5bcd-46ba-94ff-7e74e099d831,Anthony Parker,3663.79,"Anthony Parker works as a Control and instrumentation engineer.
They earn money through their employment in the Willis, Cruz and Navarro where they have been for 7 years.
They are skilled in Optional directional alliance.",4791.11,Married,Christopher King
f4330afd-3cbb-4368-87a0-80429f95c9a1,Kevin Fowler,43643.93,"Kevin Fowler works as a Podiatrist.
They earn money through their employment in the Daniels, Bowman and Williams where they have been for 13 years.
They are skilled in Grass-roots dynamic approach.",4583.92,Married,Randall Hudson
fd4bad12-db89-4bbb-962e-581cfec706a3,Carlos Johnson,12235.18,"Carlos Johnson works as a Database administrator.
They earn money through their employment in the Tran, Church and Ramos where they have been for 17 years.
They are skilled in Diverse exuding Local Area Network.",5007.97,Married,Angela White
07c67c54-38b5-4c55-b411-5437bcf7ac01,David Calhoun,66812.55,"David Calhoun works as a Restaurant manager, fast food.
They earn money through their employment in the Sims-Jackson where they have been for 10 years.
They are skilled in Inverse leadingedge interface.",1024.81,Single,
d2ea3aca-85a9-4fe6-a758-a41d45fd362f,Kaitlin Young,33786.51,"Kaitlin Young works as a Forensic psychologist.
They earn money through their employment in the Lee PLC where they have been for 15 years.
They are skilled in Synergized actuating initiative.",2625.67,Married,Sara Brown
01179edd-822e-466d-a605-d233109d0512,Anita Hansen,34246.73,"Anita Hansen works as a Amenity horticulturist.
They earn money through their employment in the Anderson and Sons where they have been for 18 years.
They are skilled in Multi-lateral reciprocal hierarchy.",7086.42,Single,
283f07da-ef60-46e5-886d-23ec9d8eac9a,Dennis Mclaughlin,61527.15,"Dennis Mclaughlin works as a Trade union research officer.
They earn money through their employment in the Lyons Ltd where they have been for 1 years.
They are skilled in Automated modular conglomeration.",3192.46,Married,Stephanie Strong
0f1879e2-4155-4ec4-925e-52f252d43409,Trevor Ward,77934.3,"Trevor Ward works as a Early years teacher.
They earn money through their employment in the Boyle LLC where they have been for 6 years.
They are skilled in Phased well-modulated parallelism.",5427.11,Married,Jeffery Williams
0c674fb7-49d0-4f0b-bbdd-bef9ba2c6e14,Karen Edwards,44673.46,"Karen Edwards works as a Medical technical officer.
They earn money through their employment in the Wade-King where they have been for 6 years.
They are skilled in Compatible hybrid standardization.",3261.03,Single,
38bf400f-4679-4b9d-a193-730a26089355,Darren Mccullough,60066.65,"Darren Mccullough works as a Journalist, magazine.
They earn money through their employment in the Macias and Sons where they have been for 4 years.
They are skilled in Team-oriented object-oriented conglomeration.",6278.92,Single,
c7557048-a3dc-4d2c-b7d9-dec42379827b,Michelle Foley,61896.07,"Michelle Foley works as a IT consultant.
They earn money through their employment in the Murphy, English and Lowe where they have been for 16 years.
They are skilled in Enterprise-wide foreground circuit.",6085.43,Single,
40f6b3ec-2f6c-4444-a585-1014bf6de212,Marie Watson,34878.81,"Marie Watson works as a Equality and diversity officer.
They earn money through their employment in the Bolton-Thompson where they have been for 6 years.
They are skilled in Ergonomic uniform instruction set.",2668.46,Married,Kathryn Rhodes
97adfc67-ec84-46f7-991f-9e54364127ed,Jonathan Hughes,95728.4,"Jonathan Hughes works as a Chiropractor.
They earn money through their employment in the Smith and Sons where they have been for 19 years.
They are skilled in Distributed full-range middleware.",5744.36,Single,
02e0ec07-c7ce-4930-8a6f-0d0124cd7568,Ryan Palmer,46067.98,"Ryan Palmer works as a Press sub.
They earn money through their employment in the Sutton and Sons where they have been for 13 years.
They are skilled in Persevering system-worthy protocol.",9530.98,Single,
867d4f4c-9f99-4eb3-98db-fea76fab9b7e,Jeremiah Smith,26859.27,"Jeremiah Smith works as a Office manager.
They earn money through their employment in the Jones, Chapman and Hutchinson where they have been for 2 years.
They are skilled in Persevering stable attitude.",2425.94,Single,
31c1c55e-524b-48be-ba6d-5ed38e54b2e9,Jacqueline Flores,56462.68,"Jacqueline Flores works as a Insurance risk surveyor.
They earn money through their employment in the Vazquez and Sons where they have been for 17 years.
They are skilled in Universal dedicated parallelism.",6482.76,Single,
52824c44-f3ba-4280-aec3-f2f34b9057b9,Diana Aguilar,77106.44,"Diana Aguilar works as a Patent attorney.
They earn money through their employment in the Castaneda Ltd where they have been for 4 years.
They are skilled in Multi-layered systemic project.",6478.46,Single,
b710e868-e612-47a2-9421-ab050a267093,James Washington,31879.38,"James Washington works as a Dealer.
They earn money through their employment in the Nixon Inc where they have been for 10 years.
They are skilled in Optional coherent database.",8878.56,Single,
c8e8f464-c67b-4215-b902-c608386c3749,Kenneth Moore MD,10031.91,"Kenneth Moore MD works as a Pharmacologist.
They earn money through their employment in the Davis, Carr and Williams where they have been for 5 years.
They are skilled in Down-sized heuristic methodology.",7446.84,Single,
64d7abcf-be62-47af-8e50-179bdd811869,Cameron Wagner,79509.62,"Cameron Wagner works as a Scientist, audiological.
They earn money through their employment in the Murphy-Jackson where they have been for 16 years.
They are skilled in Reactive clear-thinking database.",9579.45,Single,
4aaa905e-ff68-4186-8652-79f9f3295f7b,Michelle Johnson MD,62192.97,"Michelle Johnson MD works as a Charity officer.
They earn money through their employment in the White, Ford and Douglas where they have been for 11 years.
They are skilled in Open-architected multimedia analyzer.",5714.61,Married,Bradley Davis
322fca45-1d53-4e93-ac1e-4e376f084186,Cindy Torres,50828.33,"Cindy Torres works as a Translator.
They earn money through their employment in the Ramirez, Lee and Rogers where they have been for 6 years.
They are skilled in Pre-emptive bifurcated ability.",8460.72,Single,
1501ebc4-e29a-495b-b4eb-a6b1e562081c,Maria Hardy,36411.88,"Maria Hardy works as a Therapeutic radiographer.
They earn money through their employment in the Adams Inc where they have been for 17 years.
They are skilled in Synchronized solution-oriented workforce.",1518.61,Single,
624b05d6-4ce9-47f9-9b39-28e3cfe79601,Thomas Hayes,15377.04,"Thomas Hayes works as a Engineer, technical sales.
They earn money through their employment in the Flowers, Wilkerson and Spencer where they have been for 14 years.
They are skilled in Grass-roots client-server firmware.",7413.14,Married,Erin Kelly
db69908b-67b9-4036-b043-eb64ba223e4f,Megan Price,61634.27,"Megan Price works as a Production assistant, television.
They earn money through their employment in the Bryant, Carey and Andrade where they have been for 1 years.
They are skilled in Advanced bottom-line encoding.",7395.69,Single,
832e2a43-50a9-4316-96b0-18549452ec31,Carol Alvarado,18457.69,"Carol Alvarado works as a Insurance broker.
They earn money through their employment in the Bailey-Clark where they have been for 6 years.
They are skilled in Cross-group coherent application.",8266.87,Married,Erin Lowe
7095fe1d-2e9d-4970-af8f-d9707a3e291b,Brenda Miller,70467.89,"Brenda Miller works as a Water engineer.
They earn money through their employment in the Harris, Frazier and Kramer where they have been for 3 years.
They are skilled in Fully-configurable directional project.",7645.66,Single,
209fdb4b-1a26-4f65-b38c-bb619834e29c,Rebecca Lawson,36388.94,"Rebecca Lawson works as a Telecommunications researcher.
They earn money through their employment in the Vazquez PLC where they have been for 7 years.
They are skilled in Organic multi-state analyzer.",2190.6,Married,Bob Meyers
b524d93d-cd6d-497d-9f2f-4a60c0b6edd3,David Hall,12542.96,"David Hall works as a Mental health nurse.
They earn money through their employment in the Merritt, Scott and Simpson where they have been for 9 years.
They are skilled in Open-source fresh-thinking architecture.",9136.14,Married,Bradley Payne
f995f2c2-9309-4bb6-b0c8-5df3f5003079,Justin Henry,10369.8,"Justin Henry works as a Animator.
They earn money through their employment in the Clark, Watkins and Ballard where they have been for 1 years.
They are skilled in Persevering actuating extranet.",7052.68,Married,Richard Stewart
cb53769c-dfc0-4370-8b0e-cc8d118a8d9c,Richard Burton,10582.85,"Richard Burton works as a Air cabin crew.
They earn money through their employment in the Thomas-Mueller where they have been for 20 years.
They are skilled in Automated logistical portal.",1783.05,Married,Joseph King
19844993-5ffd-4c8e-9787-a5c656e26b1a,Katherine Cochran,4220.75,"Katherine Cochran works as a Adult nurse.
They earn money through their employment in the Nelson-Perez where they have been for 5 years.
They are skilled in Up-sized executive conglomeration.",9935.49,Married,Tracy Clark
9b75e405-3be1-44bf-adbe-112d23f839fa,Anthony Hampton,22413.09,"Anthony Hampton works as a Hydrologist.
They earn money through their employment in the Davis-Goodwin where they have been for 11 years.
They are skilled in Optimized user-facing open architecture.",1110.57,Married,Andres Parsons
39dc023d-c86d-4f84-8600-be29dae3de66,Nancy Evans,4259.51,"Nancy Evans works as a Minerals surveyor.
They earn money through their employment in the Barnes Group where they have been for 13 years.
They are skilled in Monitored contextually-based instruction set.",5049.46,Married,Amy Crawford
d5883d82-69b4-490b-9729-664e0decf16d,Tonya Rivera,55929.19,"Tonya Rivera works as a Television/film/video producer.
They earn money through their employment in the Fischer PLC where they have been for 7 years.
They are skilled in Up-sized bandwidth-monitored website.",6511.48,Married,Brent Murphy
d27d9a56-c6d2-434b-8d14-9bdcb2f0f2be,Jessica Mason,17645.06,"Jessica Mason works as a Financial controller.
They earn money through their employment in the Lopez, Wall and Watkins where they have been for 11 years.
They are skilled in Object-based responsive secured line.",6279.02,Married,Tara Sweeney
653783bc-424b-4fc0-8ba4-66b7e0bdb9f7,Michelle Curry,25377.56,"Michelle Curry works as a Immunologist.
They earn money through their employment in the Lin, Fox and Wilson where they have been for 15 years.
They are skilled in Open-source contextually-based productivity.",3504.01,Married,Andrea Phillips
c0ffdd91-9a8d-4be6-956c-f6723e132c38,Kurt Wiggins,95969.97,"Kurt Wiggins works as a Food technologist.
They earn money through their employment in the Joyce, Kelly and Smith where they have been for 6 years.
They are skilled in Devolved scalable extranet.",6684.39,Married,Lori York
c6e84335-9f7a-4b77-bcc8-6d194e11c612,Justin Carpenter,77596.1,"Justin Carpenter works as a Investment analyst.
They earn money through their employment in the Conley and Sons where they have been for 18 years.
They are skilled in Assimilated bi-directional approach.",1440.88,Single,
50dd4f86-3c73-40ca-8e46-b5147b5fd242,Ashley Jordan,51888.03,"Ashley Jordan works as a Accountant, chartered public finance.
They earn money through their employment in the Holmes-Durham where they have been for 10 years.
They are skilled in Diverse cohesive budgetary management.",6657.32,Married,Bradley White
73c64f23-94d7-4e2b-9d35-7f52c5c7dfad,Nicole Cook,6824.95,"Nicole Cook works as a Scientific laboratory technician.
They earn money through their employment in the Miller, Manning and Melendez where they have been for 1 years.
They are skilled in Total bottom-line encoding.",6729.59,Single,
c8dd3c18-1e8b-4759-8189-e46219671cd8,Debra May,82876.65,"Debra May works as a Multimedia specialist.
They earn money through their employment in the Thompson, Horton and White where they have been for 13 years.
They are skilled in Front-line multimedia implementation.",2512.59,Single,
1b4fc9ca-73ba-44d1-8713-bd78b800d3b1,Linda Sanchez,63032.39,"Linda Sanchez works as a Surveyor, planning and development.
They earn money through their employment in the Johnson, Mcfarland and Escobar where they have been for 7 years.
They are skilled in User-centric zero-defect migration.",5555.18,Married,Catherine Dickson
43fc32df-6ea4-4f7b-ae78-a1bcd6dc41fb,Dr. Steven Pugh,54403.43,"Dr. Steven Pugh works as a Engineer, maintenance (IT).
They earn money through their employment in the Smith-Gonzalez where they have been for 11 years.
They are skilled in User-centric bifurcated circuit.",9655.33,Married,Sarah Weaver
7a062ca8-69cf-4f7b-9b51-1cc7de0800cd,Eric Reid,80323.28,"Eric Reid works as a Chief Executive Officer.
They earn money through their employment in the Wood Ltd where they have been for 11 years.
They are skilled in Innovative hybrid array.",2155.36,Married,Christine Ryan
beb21083-c890-4399-94e7-361356b8508e,Samuel Smith,57417.81,"Samuel Smith works as a Museum/gallery exhibitions officer.
They earn money through their employment in the Lloyd-Farrell where they have been for 10 years.
They are skilled in Integrated solution-oriented website.",9000.36,Single,
c3be2be7-158a-4671-804d-1dbc5a8cf420,Robin Reyes,54231.9,"Robin Reyes works as a Public relations officer.
They earn money through their employment in the Hall and Sons where they have been for 12 years.
They are skilled in Cloned bandwidth-monitored leverage.",7629.06,Married,Fernando Webb
16bd1e0a-7882-4cdf-80ad-45b45e9e2fd4,Robert Jackson,3519.25,"Robert Jackson works as a Insurance claims handler.
They earn money through their employment in the Lee-Miller where they have been for 4 years.
They are skilled in Pre-emptive asymmetric neural-net.",8657.82,Single,
16efea31-d528-4d90-af93-3134324b1529,Jake Johnson,68862.81,"Jake Johnson works as a Retail banker.
They earn money through their employment in the Patterson, Walker and Mcintosh where they have been for 14 years.
They are skilled in Automated static pricing structure.",6311.01,Single,
aebdf782-df08-4e92-a6e3-f968521b1e61,Sarah Wilson,14771.12,"Sarah Wilson works as a Tree surgeon.
They earn money through their employment in the Rice PLC where they have been for 14 years.
They are skilled in User-centric optimal orchestration.",7060.19,Single,
2df525d3-bb37-4a87-9e77-d1bdd2ef691f,Anita Gibbs,71484.08,"Anita Gibbs works as a Clothing/textile technologist.
They earn money through their employment in the Hill-Ingram where they have been for 7 years.
They are skilled in Exclusive heuristic matrices.",1976.15,Single,
e7f25e88-fec0-4b52-9266-98e78d1a1fc1,Tina Johnson,79693.85,"Tina Johnson works as a Horticultural consultant.
They earn money through their employment in the Wells-Chavez where they have been for 3 years.
They are skilled in Reduced responsive ability.",5241.67,Single,
132d5ddb-640d-4a64-98e9-faca466333a6,Brian Perry,78202.94,"Brian Perry works as a Horticulturist, commercial.
They earn money through their employment in the Terry-Lopez where they have been for 12 years.
They are skilled in Seamless mobile capability.",5430.12,Single,
b0860a2b-e392-4fca-a6fc-7667e0ab63cd,Jeffrey Berger,74140.66,"Jeffrey Berger works as a Civil engineer, consulting.
They earn money through their employment in the Rice and Sons where they have been for 16 years.
They are skilled in Digitized interactive analyzer.",1984.09,Single,
32a45d23-17c0-42af-b824-2ef1680a2f10,David Warren,70228.12,"David Warren works as a Interpreter.
They earn money through their employment in the Brown Ltd where they have been for 20 years.
They are skilled in Operative methodical protocol.",2719.27,Single,
57aa1ebd-48c9-462b-895c-81f76c3ef02b,Lisa Ellis,66886.3,"Lisa Ellis works as a Production engineer.
They earn money through their employment in the Ortiz Inc where they have been for 14 years.
They are skilled in Profit-focused client-driven methodology.",7699.27,Single,
a9e288de-0714-41d3-ad08-7e20ddf17ff3,Nicholas Wiggins,91089.25,"Nicholas Wiggins works as a Product/process development scientist.
They earn money through their employment in the Martinez-Smith where they have been for 17 years.
They are skilled in Programmable heuristic definition.",5495.88,Single,
