id,name,balance,description,income,marriage,spouse
976c46bc-020e-487b-b999-475dbd71fb7f,Kristina Spears,33040.31,"Kristina Spears works as a Heritage manager.
They earn money through their employment in the Stevens Group where they have been for 14 years.
They are skilled in Optimized impactful software.",1201.39,Single,
d6f0e122-6107-40a4-a483-8485aa8c4111,Michael Butler,53011.84,"Michael Butler works as a Audiological scientist.
They earn money through their employment in the Jefferson Group where they have been for 5 years.
They are skilled in Versatile 24/7 artificial intelligence.",6667.92,Married,John Kelly
ea9caa9d-c918-4cf1-9edb-989adecc64d3,Maria Harris,87385.75,"Maria Harris works as a Legal executive.
They earn money through their employment in the Greene and Sons where they have been for 6 years.
They are skilled in Up-sized fault-tolerant ability.",5596.48,Single,
061c7f99-beb8-44d1-b56c-8272ee803831,Jill Coleman,42814.31,"Jill Coleman works as a Database administrator.
They earn money through their employment in the Allen-Thompson where they have been for 4 years.
They are skilled in Ergonomic responsive collaboration.",2269.58,Single,
4f5d2939-2f05-4e7d-adeb-6ff1f51f3999,David Edwards,97647.09,"David Edwards works as a Public affairs consultant.
They earn money through their employment in the Mcgrath-Clark where they have been for 13 years.
They are skilled in Operative contextually-based concept.",3661.82,Single,
e1199088-3e21-48a7-a14a-8a4a2963012b,Robert Payne,66733.37,"Robert Payne works as a Ergonomist.
They earn money through their employment in the George Inc where they have been for 9 years.
They are skilled in Organized neutral matrices.",9752.72,Married,Craig Meadows
01c86e97-8a70-4906-ad55-0cf7eadd766c,Scott Whitaker,41728.88,"Scott Whitaker works as a Careers information officer.
They earn money through their employment in the Owens-Green where they have been for 6 years.
They are skilled in Function-based bandwidth-monitored task-force.",9486.85,Married,Christopher Williams
92bbc463-7ae7-4364-a5d2-5e0f71e66661,Dominic Rivera,42101.6,"Dominic Rivera works as a Building services engineer.
They earn money through their employment in the Edwards, Solomon and Williams where they have been for 9 years.
They are skilled in Re-contextualized non-volatile pricing structure.",5207.84,Single,
89522ef2-9dd2-4727-acef-ae1b923691e2,Kristin Smith,81608.08,"Kristin Smith works as a Medical secretary.
They earn money through their employment in the Edwards, Howard and Levine where they have been for 7 years.
They are skilled in Decentralized neutral array.",4741.59,Married,Anthony Acosta
b3046782-04ed-4e2b-8fb7-38a1c575f28f,Tiffany Ruiz,14529.92,"Tiffany Ruiz works as a Museum/gallery exhibitions officer.
They earn money through their employment in the Coleman-Jimenez where they have been for 11 years.
They are skilled in Secured grid-enabled framework.",1045.22,Single,
2e269184-b416-43e6-ad6b-d4903ac946e6,William Hancock,42049.98,"William Hancock works as a Multimedia programmer.
They earn money through their employment in the Berry, Lawson and Leonard where they have been for 4 years.
They are skilled in Reduced systematic algorithm.",2254.54,Single,
55cf38fb-0fee-4148-8a18-4e665a5f6a33,Joseph Petty,67415.79,"Joseph Petty works as a Restaurant manager, fast food.
They earn money through their employment in the Landry-Novak where they have been for 18 years.
They are skilled in Sharable empowering collaboration.",4809.8,Married,Nathan Miller
6281e447-f9fd-4be6-96b5-2553274fe606,Dr. Daisy Robinson,22225.42,"Dr. Daisy Robinson works as a Database administrator.
They earn money through their employment in the Banks-Graves where they have been for 10 years.
They are skilled in Cross-platform optimizing knowledgebase.",6069.01,Single,
46191b97-444a-4845-94e5-dd90209203e5,Ann Hamilton,78057.32,"Ann Hamilton works as a Retail buyer.
They earn money through their employment in the Taylor, Smith and Griffith where they have been for 15 years.
They are skilled in Managed cohesive benchmark.",5371.5,Single,
e370e9f9-f20b-475c-ad1c-98b31244374b,Christopher Palmer,41004.77,"Christopher Palmer works as a Insurance broker.
They earn money through their employment in the Powers and Sons where they have been for 16 years.
They are skilled in De-engineered high-level system engine.",2099.5,Married,Alexandra Cook
752dddef-4d57-42d7-9590-bcdc3ad5f433,Sue Ball,56120.12,"Sue Ball works as a Freight forwarder.
They earn money through their employment in the Wallace, Barry and Holland where they have been for 8 years.
They are skilled in Sharable local infrastructure.",7640.52,Single,
54da02a3-1f3c-4b1b-a995-e97b623d883b,Kevin Cline,9991.34,"Kevin Cline works as a Radiation protection practitioner.
They earn money through their employment in the Robinson, Ball and Young where they have been for 17 years.
They are skilled in Upgradable executive solution.",6388.15,Married,Lisa Tucker
12707641-2192-4a43-b1ba-5e6168fc4ede,Michael Jones,36464.44,"Michael Jones works as a Mechanical engineer.
They earn money through their employment in the Johnson PLC where they have been for 15 years.
They are skilled in Monitored mobile utilization.",3475.68,Married,Hannah Wall
54ab9235-bab6-4916-8458-e15698c9fd47,Christopher Norton,29362.81,"Christopher Norton works as a Product/process development scientist.
They earn money through their employment in the Hall Inc where they have been for 7 years.
They are skilled in Pre-emptive disintermediate encryption.",3411.0,Married,Cindy Gardner
86ad0792-05f5-424f-bb36-5f1bf86804f2,Tracy Clark,42402.04,"Tracy Clark works as a Customer service manager.
They earn money through their employment in the Griffin, Gallagher and Huynh where they have been for 18 years.
They are skilled in Secured multimedia methodology.",1239.69,Married,Thomas Lyons
dc43c531-d353-4f9e-bdf4-a681e26fd9c4,Tina Jenkins,18119.47,"Tina Jenkins works as a Cabin crew.
They earn money through their employment in the Bender Group where they have been for 8 years.
They are skilled in Re-contextualized 5thgeneration array.",2608.07,Single,
f79befbf-618d-4a8f-ac66-cb7ba434dd9b,Tiffany Henry,9400.61,"Tiffany Henry works as a Accountant, chartered public finance.
They earn money through their employment in the King Inc where they have been for 8 years.
They are skilled in User-centric reciprocal time-frame.",7036.57,Single,
7a158fb6-5fdb-4ce7-84c5-1cc32b4dc2c7,Katie Johnson,43319.96,"Katie Johnson works as a Patent attorney.
They earn money through their employment in the Hunt-Melendez where they have been for 13 years.
They are skilled in Sharable bi-directional artificial intelligence.",9867.1,Single,
71c0b08d-9a33-4824-95e6-a71a67fd6160,Hailey Stuart,85864.7,"Hailey Stuart works as a Museum/gallery exhibitions officer.
They earn money through their employment in the Gonzalez, Scott and Valentine where they have been for 13 years.
They are skilled in Function-based bandwidth-monitored open architecture.",1304.15,Single,
3a2ce1e3-6940-45bb-959d-b66b7df6fbc9,Bradley Guzman,44723.59,"Bradley Guzman works as a Learning mentor.
They earn money through their employment in the Hernandez PLC where they have been for 2 years.
They are skilled in Centralized optimal installation.",4865.99,Married,Megan Wright
c71b5864-1982-4a77-a965-338c0a03706c,Martha Miller,4949.54,"Martha Miller works as a Editor, commissioning.
They earn money through their employment in the Cruz, Ramirez and Cook where they have been for 5 years.
They are skilled in Realigned even-keeled benchmark.",5979.89,Single,
67c5a1e1-a74e-4263-9ba9-8d8e626a02d8,Melissa Schmidt,49468.06,"Melissa Schmidt works as a Psychotherapist, dance movement.
They earn money through their employment in the Trujillo, Rose and Rivera where they have been for 12 years.
They are skilled in De-engineered motivating process improvement.",5337.67,Single,
cbe1d68b-11f1-48bc-9c91-194df4dc0153,Luis Edwards,21452.7,"Luis Edwards works as a Research scientist (physical sciences).
They earn money through their employment in the Hall-Moore where they have been for 12 years.
They are skilled in Managed next generation workforce.",2512.64,Married,Jane Ortiz
a36b77e1-040c-4f4b-9f54-4aeeef26cc47,Michael Mcclain,51401.06,"Michael Mcclain works as a Immigration officer.
They earn money through their employment in the Ford-Saunders where they have been for 20 years.
They are skilled in Extended homogeneous application.",2200.67,Married,Randall Miles
9116d909-6af7-49ce-825b-864782aa3bdf,Anita Moore,58790.47,"Anita Moore works as a Engineer, electrical.
They earn money through their employment in the Lee PLC where they have been for 7 years.
They are skilled in Phased well-modulated superstructure.",7267.07,Single,
397a45e2-92da-4037-9835-686cd44bcb08,Ryan Campbell,2513.14,"Ryan Campbell works as a Sound technician, broadcasting/film/video.
They earn money through their employment in the Crawford-Johnson where they have been for 14 years.
They are skilled in Assimilated mission-critical paradigm.",9657.62,Single,
1fecef95-f482-4948-8b82-93a698b688f3,Samuel Guerra,20361.6,"Samuel Guerra works as a Occupational hygienist.
They earn money through their employment in the Vargas, Ball and King where they have been for 16 years.
They are skilled in Public-key disintermediate budgetary management.",1313.76,Married,Christina Case
7007840d-d02f-4751-96a6-49390093ec02,Brent Nguyen,42211.64,"Brent Nguyen works as a Lecturer, higher education.
They earn money through their employment in the Rodriguez Ltd where they have been for 7 years.
They are skilled in Organized methodical synergy.",5153.76,Single,
5ea7ccc7-8776-4af0-890f-e63501c8852f,Bailey Savage,1543.21,"Bailey Savage works as a Teacher, special educational needs.
They earn money through their employment in the Blake Ltd where they have been for 19 years.
They are skilled in Customizable content-based middleware.",9923.07,Single,
95dbdbff-b37f-4aa3-a7b5-b0db703a38f9,Theresa Day,16435.2,"Theresa Day works as a Environmental education officer.
They earn money through their employment in the Medina Ltd where they have been for 1 years.
They are skilled in Progressive analyzing algorithm.",4656.08,Married,Eddie Wiggins
37713784-2cc9-4aea-a196-7d28677e1bd4,Edward Howe,23844.49,"Edward Howe works as a Architectural technologist.
They earn money through their employment in the Carlson, Roberts and Allen where they have been for 9 years.
They are skilled in User-friendly context-sensitive paradigm.",8647.75,Single,
05f09ba5-5e6a-4c48-91c9-3b5fa703890e,Sydney Oliver,70258.72,"Sydney Oliver works as a Fisheries officer.
They earn money through their employment in the Ortiz, Smith and Jacobs where they have been for 11 years.
They are skilled in Right-sized tertiary middleware.",3824.44,Married,Richard Rogers
903910c7-5263-419f-883a-229c8c93ded3,Bernard Sanders,31090.43,"Bernard Sanders works as a Sport and exercise psychologist.
They earn money through their employment in the Lopez Inc where they have been for 14 years.
They are skilled in Expanded reciprocal data-warehouse.",9665.47,Married,Katherine Blackwell
910f2ac5-3d97-4c69-b5c9-3d0730d8262a,Eric Blevins,18851.62,"Eric Blevins works as a Journalist, newspaper.
They earn money through their employment in the Leblanc-Little where they have been for 17 years.
They are skilled in Devolved mission-critical approach.",4484.16,Married,James Bautista
d69d8f51-be30-4d77-8382-5f4daea653a7,Dr. Stephanie Howell,43570.46,"Dr. Stephanie Howell works as a Risk manager.
They earn money through their employment in the Hunt, Matthews and Brown where they have been for 5 years.
They are skilled in Expanded attitude-oriented application.",1296.16,Married,Dennis Woods
3179746b-7996-43d1-9542-89cf351898ca,Jacqueline Pollard,97158.59,"Jacqueline Pollard works as a Systems developer.
They earn money through their employment in the Clark PLC where they have been for 3 years.
They are skilled in Sharable solution-oriented framework.",4990.55,Married,Lisa Gonzalez
f2a5b922-df54-4480-9303-722525b43fc6,Charles Lopez,86961.39,"Charles Lopez works as a Fitness centre manager.
They earn money through their employment in the Pittman-Reynolds where they have been for 17 years.
They are skilled in Multi-layered web-enabled workforce.",3854.85,Single,
de682b0c-b82e-498e-83b2-10b83a6427dd,Keith Gamble,49166.23,"Keith Gamble works as a Artist.
They earn money through their employment in the Cohen-Murray where they have been for 8 years.
They are skilled in Enhanced intangible challenge.",3767.65,Married,Carolyn Walters
6103737b-98a4-4092-9486-f6b4e00b0a99,Courtney Price,52844.7,"Courtney Price works as a Production assistant, radio.
They earn money through their employment in the Silva, Gonzalez and Simmons where they have been for 9 years.
They are skilled in Grass-roots neutral framework.",2916.52,Married,Edwin Robinson
4443d5c0-3ed8-415f-936c-4e5e83b49dae,Jennifer Cruz,9692.1,"Jennifer Cruz works as a Therapist, speech and language.
They earn money through their employment in the English Inc where they have been for 10 years.
They are skilled in Reverse-engineered systemic hub.",8645.32,Single,
c80f5837-275a-4e6b-9242-1fa5d4de1cf9,Christopher Fuller,81563.0,"Christopher Fuller works as a English as a second language teacher.
They earn money through their employment in the Key-Doyle where they have been for 10 years.
They are skilled in Organic disintermediate middleware.",6434.38,Single,
f5682e0e-37a4-41e0-99b2-05e924ecbbff,David Ryan,17744.21,"David Ryan works as a Medical secretary.
They earn money through their employment in the Jensen LLC where they have been for 18 years.
They are skilled in Fully-configurable 4thgeneration forecast.",2026.21,Single,
4d64656d-e8c4-4cac-82c1-40de73cf9b83,Brenda Jones,28169.0,"Brenda Jones works as a Call centre manager.
They earn money through their employment in the Wright and Sons where they have been for 5 years.
They are skilled in Face-to-face coherent software.",1201.37,Single,
966d734a-bfd9-4b23-97f2-50b775459a0b,Yvette Collins,34962.44,"Yvette Collins works as a Therapist, occupational.
They earn money through their employment in the Peters Ltd where they have been for 1 years.
They are skilled in Multi-lateral stable software.",9199.77,Single,
408eb8aa-c9e8-4df7-b5d2-c044aded9ebd,Brooke Kelly,53534.79,"Brooke Kelly works as a Operational researcher.
They earn money through their employment in the Miles, Hobbs and Mason where they have been for 14 years.
They are skilled in Proactive next generation conglomeration.",6802.21,Single,
a088f59a-2f85-43a0-b1c9-af763cca8a5e,Francisco Allen,70662.93,"Francisco Allen works as a Conservator, furniture.
They earn money through their employment in the Garcia Inc where they have been for 16 years.
They are skilled in Extended full-range attitude.",4844.51,Single,
bf8ef8f2-19ff-4e0b-b4f3-4bc30127fac1,Paul Reyes,37876.36,"Paul Reyes works as a Horticultural consultant.
They earn money through their employment in the Henry, Tucker and Thomas where they have been for 6 years.
They are skilled in Future-proofed asynchronous migration.",3712.31,Married,Ryan Keith
5a3339a7-48d1-4ded-a492-0ebb47d8393c,Ian Reilly,62969.58,"Ian Reilly works as a Recycling officer.
They earn money through their employment in the Nguyen-Wright where they have been for 1 years.
They are skilled in Synchronized scalable implementation.",5110.89,Single,
b3e9a0bb-febc-4363-b5f7-04a8782012fe,James Martin,78796.05,"James Martin works as a Scientist, clinical (histocompatibility and immunogenetics).
They earn money through their employment in the Cannon, Keller and Flowers where they have been for 13 years.
They are skilled in Enhanced responsive frame.",2059.13,Married,Johnny Frey
abf7cc43-9139-4b39-9c7e-8e99191b566b,Tracy West,10750.92,"Tracy West works as a Race relations officer.
They earn money through their employment in the Rogers, Ortiz and Singh where they have been for 10 years.
They are skilled in Pre-emptive bi-directional firmware.",1538.63,Married,Richard Lee
480399b6-f560-4793-b650-eee465bde371,Jennifer Hall,27810.04,"Jennifer Hall works as a Data scientist.
They earn money through their employment in the Nguyen, Castro and Green where they have been for 12 years.
They are skilled in Versatile bandwidth-monitored analyzer.",5642.75,Single,
417dbf67-6fee-4d35-b295-9febb2c01d2f,Edward Marshall,73298.47,"Edward Marshall works as a Television/film/video producer.
They earn money through their employment in the Phillips Inc where they have been for 5 years.
They are skilled in Re-engineered 3rdgeneration service-desk.",8233.04,Single,
474a84f2-21ef-473f-8511-a3cca426d980,James Butler,67510.31,"James Butler works as a Scientist, water quality.
They earn money through their employment in the Simmons-Young where they have been for 17 years.
They are skilled in Focused incremental matrices.",8789.83,Single,
dac196cb-c578-47d5-8bd4-3b378de3ff63,Michael Hall,17761.76,"Michael Hall works as a Designer, ceramics/pottery.
They earn money through their employment in the Patterson, Atkins and Mata where they have been for 19 years.
They are skilled in Front-line composite concept.",7605.67,Married,Shelley Gonzales
50eb0c77-3601-421d-b553-5651fc2d2474,Ronald Harper,30453.88,"Ronald Harper works as a Engineer, materials.
They earn money through their employment in the Miles-Vargas where they have been for 12 years.
They are skilled in Diverse national encryption.",1180.32,Single,
becbdfe9-c73a-4097-9f3e-396ab4fecd3a,Miss Patricia Alvarez,40625.39,"Miss Patricia Alvarez works as a Systems developer.
They earn money through their employment in the Ward, Smith and Cantu where they have been for 14 years.
They are skilled in Proactive clear-thinking infrastructure.",1303.55,Married,Elizabeth Eaton
fcc1414b-ac03-480f-b931-beae4a11fa0c,Jason Trujillo,41777.86,"Jason Trujillo works as a Health and safety adviser.
They earn money through their employment in the Oconnell Inc where they have been for 11 years.
They are skilled in Self-enabling optimal data-warehouse.",2986.1,Single,
1835e614-de73-435d-baa6-8c0034c3448d,Valerie Martin,57343.36,"Valerie Martin works as a Educational psychologist.
They earn money through their employment in the Hamilton, Richardson and Reid where they have been for 11 years.
They are skilled in Open-architected zero tolerance productivity.",2702.82,Single,
43e2a963-a64c-4d03-8a67-0db830fb2cbb,Michael George,74968.22,"Michael George works as a Energy manager.
They earn money through their employment in the Hernandez, Elliott and Jimenez where they have been for 5 years.
They are skilled in Re-engineered context-sensitive orchestration.",6752.85,Single,
31dfe62d-6ba0-469f-8481-b1fbfe6e2b67,Jason Gardner,54834.65,"Jason Gardner works as a Adult guidance worker.
They earn money through their employment in the Mullen PLC where they have been for 12 years.
They are skilled in Universal background project.",5688.74,Single,
f0b50ab6-9b3a-4912-bce6-328908f9e944,Zachary Dodson,60851.92,"Zachary Dodson works as a Clinical molecular geneticist.
They earn money through their employment in the Nunez Ltd where they have been for 11 years.
They are skilled in Upgradable bandwidth-monitored encryption.",5306.61,Married,Aaron Hall
5c7a08f8-b2d4-4300-af3f-fff6b1a65631,Rebecca Campbell,18504.66,"Rebecca Campbell works as a Forest/woodland manager.
They earn money through their employment in the Santana Group where they have been for 12 years.
They are skilled in Organized needs-based service-desk.",9240.93,Single,
f163cc37-9c84-4703-9e22-7c0e38e0f855,Heather Gray,32093.19,"Heather Gray works as a Secretary, company.
They earn money through their employment in the Spence PLC where they have been for 11 years.
They are skilled in Triple-buffered real-time frame.",3363.39,Married,Matthew Brown
b9aac839-86c3-4389-a146-b49a5c717274,Patricia Smith,79651.64,"Patricia Smith works as a Sports administrator.
They earn money through their employment in the Mcmillan-Schwartz where they have been for 3 years.
They are skilled in Object-based scalable Local Area Network.",9181.96,Single,
0f20ec32-9f2a-41d6-9e44-c325cd942e7c,Anthony Stanley,76399.43,"Anthony Stanley works as a Art gallery manager.
They earn money through their employment in the Garner Ltd where they have been for 9 years.
They are skilled in Down-sized solution-oriented firmware.",6825.22,Single,
a9943819-3d1c-41a3-8d07-dbbf92921dc7,Sean Holloway,39685.47,"Sean Holloway works as a Product/process development scientist.
They earn money through their employment in the Robles Group where they have been for 3 years.
They are skilled in Business-focused user-facing circuit.",9886.34,Single,
1745321d-7168-40b6-a1fa-2600d3d34df6,Dawn Warren,10063.11,"Dawn Warren works as a Accountant, chartered certified.
They earn money through their employment in the Hardy-Chavez where they have been for 5 years.
They are skilled in Multi-lateral cohesive matrices.",8636.99,Married,Brian Williams
d52e8263-a5eb-453e-a0a1-6410748ecdd9,Timothy Blair,89287.53,"Timothy Blair works as a Nature conservation officer.
They earn money through their employment in the Martin Ltd where they have been for 10 years.
They are skilled in Enterprise-wide uniform hardware.",2295.99,Married,Nicole Hunter
5dd2e730-1fd1-4a2e-8cb8-96a65561c22c,Gina Kennedy,81052.82,"Gina Kennedy works as a Librarian, academic.
They earn money through their employment in the Boyd Inc where they have been for 19 years.
They are skilled in Reduced 5thgeneration protocol.",9344.03,Single,
12137b6a-498e-418b-97d3-56fecf356b59,Juan Graham,1270.77,"Juan Graham works as a Artist.
They earn money through their employment in the Rodriguez-Webb where they have been for 7 years.
They are skilled in Open-source neutral collaboration.",6560.32,Married,Gary Kemp
c4a90060-92fc-464c-8e42-b1ee75b7e2ad,Frank Porter,55707.46,"Frank Porter works as a Psychologist, prison and probation services.
They earn money through their employment in the Johnson, Griffith and Osborn where they have been for 7 years.
They are skilled in Integrated user-facing benchmark.",3071.5,Married,Richard Gibbs
6c85ef2f-cec3-4a1b-be88-81ccdb2e9199,Maurice Morgan,98827.9,"Maurice Morgan works as a Engineer, land.
They earn money through their employment in the Perry LLC where they have been for 6 years.
They are skilled in Re-engineered reciprocal Internet solution.",9857.37,Married,Michael Bright
d5853ce5-ac25-463b-9f85-6aa68053b561,Stephanie Valencia,45177.15,"Stephanie Valencia works as a Clinical scientist, histocompatibility and immunogenetics.
They earn money through their employment in the Martin-Howe where they have been for 1 years.
They are skilled in Reverse-engineered contextually-based definition.",4452.23,Married,Brittney Wilson
a2181bf2-c90f-45b3-bf8a-c50cacfb881b,Darius Watkins,91675.31,"Darius Watkins works as a Building services engineer.
They earn money through their employment in the Williams-Bell where they have been for 10 years.
They are skilled in Synergized clear-thinking benchmark.",1713.17,Single,
6225193a-a211-4c7f-b306-bae86600c4be,Kathryn Williams,64593.86,"Kathryn Williams works as a Clinical research associate.
They earn money through their employment in the Nelson-Gilbert where they have been for 1 years.
They are skilled in Ameliorated demand-driven toolset.",2591.53,Married,Erika Mcdowell
e22a31ef-1f61-41b5-adfc-0ae6e23b3256,Michelle Chase MD,17505.83,"Michelle Chase MD works as a Engineer, mining.
They earn money through their employment in the Long and Sons where they have been for 18 years.
They are skilled in Robust scalable collaboration.",5229.1,Married,Melissa Baldwin DDS
575d9a71-b7bd-4315-a2d6-cb7765d1ef86,Anne Olson,90688.04,"Anne Olson works as a Designer, ceramics/pottery.
They earn money through their employment in the Lane, Lucas and Herrera where they have been for 12 years.
They are skilled in Universal scalable open system.",6430.18,Married,Joshua Hicks
58b8064e-8e75-4895-992a-9486407a3563,Joshua Bennett,61508.38,"Joshua Bennett works as a Dance movement psychotherapist.
They earn money through their employment in the Williams-Stevens where they have been for 9 years.
They are skilled in Exclusive bottom-line artificial intelligence.",3021.89,Married,Kevin Howard
14ac8dd9-5041-44f1-b129-fa06f01b20b8,Jesse Murray,53080.29,"Jesse Murray works as a Investment analyst.
They earn money through their employment in the Morgan LLC where they have been for 2 years.
They are skilled in Proactive heuristic extranet.",7725.73,Married,Amanda Perez
ac2bb5d8-6caa-469e-a5ac-85306e83d04f,Michael Aguilar,36953.46,"Michael Aguilar works as a Economist.
They earn money through their employment in the Rich-Parks where they have been for 3 years.
They are skilled in Versatile multi-tasking access.",8590.17,Married,Emily Henry
f9671d66-08e3-4ee1-9714-47e95763fd7f,Dennis Ramos,68603.72,"Dennis Ramos works as a Chartered accountant.
They earn money through their employment in the Freeman PLC where they have been for 8 years.
They are skilled in Advanced disintermediate paradigm.",8528.52,Married,Dr. Geoffrey Navarro DDS
60f6b347-f6ba-4136-a229-9bfa33cc94c8,Melissa Poole,32339.67,"Melissa Poole works as a Social researcher.
They earn money through their employment in the Briggs-Nielsen where they have been for 9 years.
They are skilled in Re-contextualized optimizing frame.",9780.69,Married,Glen Quinn
a0399bab-719c-4298-a65e-ca85ea9e6131,James Ferguson,15536.15,"James Ferguson works as a Newspaper journalist.
They earn money through their employment in the Ward, Bates and Richardson where they have been for 2 years.
They are skilled in Programmable client-driven projection.",9494.77,Married,Adam Smith
